{
  "customers": [
    {
      "id": "cust_1764767405525_afv37j",
      "name": "Tate Jones",
      "phone": "2816875501",
      "email": "",
      "zipCode": "70817",
      "vehicles": [
        "Chevy Trax"
      ],
      "totalBookings": 1,
      "totalSpent": 0,
      "firstVisit": "12/02/2025 1:31:23 am",
      "lastVisit": "12/02/2025 1:31:23 am",
      "status": "active",
      "createdAt": "2025-12-02T01:31:23.000Z"
    },
    {
      "id": "cust_1764767405526_7p3apz",
      "name": "Bryant Boyington",
      "phone": "2512143291",
      "email": "",
      "zipCode": "70809",
      "vehicles": [
        "2018 ram 1500",
        "2018 dodge ram 1500"
      ],
      "totalBookings": 2,
      "totalSpent": 0,
      "firstVisit": "12/02/2025 12:51:27 am",
      "lastVisit": "11/19/2025 3:01:29 am",
      "status": "active",
      "createdAt": "2025-12-02T00:51:27.000Z"
    },
    {
      "id": "cust_1764767405526_ntlynk",
      "name": "Annie  Morales",
      "phone": "2254396801",
      "email": "",
      "zipCode": "70806",
      "vehicles": [
        "Toyota Camry XSE"
      ],
      "totalBookings": 1,
      "totalSpent": 0,
      "firstVisit": "12/01/2025 10:53:04 pm",
      "lastVisit": "12/01/2025 10:53:04 pm",
      "status": "active",
      "createdAt": "2025-12-01T22:53:04.000Z"
    },
    {
      "id": "cust_1764767405526_v9n81r",
      "name": "Rebecca Heath",
      "phone": "2252417007",
      "email": "",
      "zipCode": "70769",
      "vehicles": [
        "2025 Toyota 4Runner"
      ],
      "totalBookings": 1,
      "totalSpent": 0,
      "firstVisit": "11/26/2025 4:44:40 pm",
      "lastVisit": "11/26/2025 4:44:40 pm",
      "status": "active",
      "createdAt": "2025-11-26T16:44:40.000Z"
    },
    {
      "id": "cust_1764767405526_rhgw1t",
      "name": "Morgan Tanner",
      "phone": "3186803524",
      "email": "",
      "zipCode": "70808",
      "vehicles": [
        "Honda CRV"
      ],
      "totalBookings": 2,
      "totalSpent": 0,
      "firstVisit": "11/26/2025 2:27:46 pm",
      "lastVisit": "07/20/2025 3:28:42 pm",
      "status": "active",
      "createdAt": "2025-11-26T14:27:46.000Z"
    },
    {
      "id": "cust_1764767405527_thyyjh",
      "name": "Robin Melancon",
      "phone": "2257187502",
      "email": "",
      "zipCode": "70772",
      "vehicles": [
        "Ram 1500 limited"
      ],
      "totalBookings": 1,
      "totalSpent": 0,
      "firstVisit": "11/25/2025 11:20:54 pm",
      "lastVisit": "11/25/2025 11:20:54 pm",
      "status": "active",
      "createdAt": "2025-11-25T23:20:54.000Z"
    },
    {
      "id": "cust_1764767405527_plv3vz",
      "name": "Jasmine Stevenson",
      "phone": "8324385145",
      "email": "",
      "zipCode": "70810",
      "vehicles": [
        "Honda Accord"
      ],
      "totalBookings": 1,
      "totalSpent": 0,
      "firstVisit": "11/25/2025 2:47:45 am",
      "lastVisit": "11/25/2025 2:47:45 am",
      "status": "active",
      "createdAt": "2025-11-25T02:47:45.000Z"
    },
    {
      "id": "cust_1764767405527_cwmos9",
      "name": "Shalacey Sterling",
      "phone": "5043889946",
      "email": "",
      "zipCode": "70726",
      "vehicles": [
        "Nissan Altima"
      ],
      "totalBookings": 1,
      "totalSpent": 0,
      "firstVisit": "11/24/2025 2:35:53 pm",
      "lastVisit": "11/24/2025 2:35:53 pm",
      "status": "active",
      "createdAt": "2025-11-24T14:35:53.000Z"
    },
    {
      "id": "cust_1764767405527_h8ttxr",
      "name": "Destiny Carter",
      "phone": "2254547557",
      "email": "",
      "zipCode": "70815",
      "vehicles": [
        "Cadillac Escalade"
      ],
      "totalBookings": 1,
      "totalSpent": 0,
      "firstVisit": "11/21/2025 1:03:45 pm",
      "lastVisit": "11/21/2025 1:03:45 pm",
      "status": "active",
      "createdAt": "2025-11-21T13:03:45.000Z"
    },
    {
      "id": "cust_1764767405527_87h8vl",
      "name": "Terence Clayton",
      "phone": "2255880043",
      "email": "",
      "zipCode": "70764",
      "vehicles": [
        "GMC AT4",
        "BMW x3"
      ],
      "totalBookings": 2,
      "totalSpent": 0,
      "firstVisit": "11/20/2025 3:22:06 pm",
      "lastVisit": "11/20/2025 3:21:38 pm",
      "status": "active",
      "createdAt": "2025-11-20T15:22:06.000Z"
    },
    {
      "id": "cust_1764767405527_9t7ays",
      "name": "Bridget Jeanlewis",
      "phone": "2255214794",
      "email": "",
      "zipCode": "70816",
      "vehicles": [
        "Nissan Altima"
      ],
      "totalBookings": 1,
      "totalSpent": 0,
      "firstVisit": "11/18/2025 10:59:28 pm",
      "lastVisit": "11/18/2025 10:59:28 pm",
      "status": "active",
      "createdAt": "2025-11-18T22:59:28.000Z"
    },
    {
      "id": "cust_1764767405527_crvjuc",
      "name": "Jatinder Goel",
      "phone": "6785579069",
      "email": "",
      "zipCode": "70810",
      "vehicles": [
        "Acura RDX"
      ],
      "totalBookings": 2,
      "totalSpent": 0,
      "firstVisit": "11/17/2025 5:39:28 pm",
      "lastVisit": "11/17/2025 2:04:10 pm",
      "status": "active",
      "createdAt": "2025-11-17T17:39:28.000Z"
    },
    {
      "id": "cust_1764767405527_ek3nqi",
      "name": "Parker Sanchez",
      "phone": "2259217879",
      "email": "",
      "zipCode": "70810",
      "vehicles": [
        "2020 Jaguar F Pace SVR"
      ],
      "totalBookings": 1,
      "totalSpent": 0,
      "firstVisit": "11/17/2025 5:07:37 pm",
      "lastVisit": "11/17/2025 5:07:37 pm",
      "status": "active",
      "createdAt": "2025-11-17T17:07:37.000Z"
    },
    {
      "id": "cust_1764767405527_r13uri",
      "name": "Kasey Soulier",
      "phone": "2252454078",
      "email": "",
      "zipCode": "70775",
      "vehicles": [
        "2020 Hyundai Palisade"
      ],
      "totalBookings": 1,
      "totalSpent": 0,
      "firstVisit": "11/15/2025 12:27:33 am",
      "lastVisit": "11/15/2025 12:27:33 am",
      "status": "active",
      "createdAt": "2025-11-15T00:27:33.000Z"
    },
    {
      "id": "cust_1764767405527_wcwu26",
      "name": "Erik Tadda",
      "phone": "2254858396",
      "email": "",
      "zipCode": "70817",
      "vehicles": [
        "GMC Yukon AT4"
      ],
      "totalBookings": 1,
      "totalSpent": 0,
      "firstVisit": "11/12/2025 2:22:46 pm",
      "lastVisit": "11/12/2025 2:22:46 pm",
      "status": "active",
      "createdAt": "2025-11-12T14:22:46.000Z"
    },
    {
      "id": "cust_1764767405527_n0jcal",
      "name": "Michael Scarborough",
      "phone": "3377395056",
      "email": "",
      "zipCode": "70810",
      "vehicles": [
        "2026 Ram 1500 Tungsten"
      ],
      "totalBookings": 1,
      "totalSpent": 0,
      "firstVisit": "11/09/2025 2:05:48 pm",
      "lastVisit": "11/09/2025 2:05:48 pm",
      "status": "active",
      "createdAt": "2025-11-09T14:05:48.000Z"
    },
    {
      "id": "cust_1764767405527_tfq5nk",
      "name": "Krishun Morgan",
      "phone": "2253023083",
      "email": "",
      "zipCode": "70811",
      "vehicles": [
        "2018 Chevrolet Camaro"
      ],
      "totalBookings": 1,
      "totalSpent": 0,
      "firstVisit": "11/09/2025 2:36:13 am",
      "lastVisit": "11/09/2025 2:36:13 am",
      "status": "active",
      "createdAt": "2025-11-09T02:36:13.000Z"
    },
    {
      "id": "cust_1764767405527_hyfmxf",
      "name": "Sardar Manpreet Singh",
      "phone": "2252775585",
      "email": "",
      "zipCode": "70810",
      "vehicles": [
        "santafe 2014"
      ],
      "totalBookings": 1,
      "totalSpent": 0,
      "firstVisit": "11/06/2025 11:36:30 pm",
      "lastVisit": "11/06/2025 11:36:30 pm",
      "status": "active",
      "createdAt": "2025-11-06T23:36:30.000Z"
    },
    {
      "id": "cust_1764767405527_nhudvv",
      "name": "Kristen Gooden",
      "phone": "7572026042",
      "email": "",
      "zipCode": "70803",
      "vehicles": [
        "Mazda Cx-30"
      ],
      "totalBookings": 1,
      "totalSpent": 0,
      "firstVisit": "11/06/2025 4:01:17 am",
      "lastVisit": "11/06/2025 4:01:17 am",
      "status": "active",
      "createdAt": "2025-11-06T04:01:17.000Z"
    },
    {
      "id": "cust_1764767405527_tlqry3",
      "name": "Vaughn Obrien",
      "phone": "8607095292",
      "email": "",
      "zipCode": "70737",
      "vehicles": [
        "volkswagen jetta"
      ],
      "totalBookings": 1,
      "totalSpent": 0,
      "firstVisit": "11/05/2025 8:01:35 am",
      "lastVisit": "11/05/2025 8:01:35 am",
      "status": "active",
      "createdAt": "2025-11-05T08:01:35.000Z"
    },
    {
      "id": "cust_1764767405527_p0eu6e",
      "name": "Tanquanee Spears",
      "phone": "2259168054",
      "email": "",
      "zipCode": "70739",
      "vehicles": [
        "Acura TL 2011"
      ],
      "totalBookings": 1,
      "totalSpent": 0,
      "firstVisit": "11/04/2025 2:35:47 am",
      "lastVisit": "11/04/2025 2:35:47 am",
      "status": "active",
      "createdAt": "2025-11-04T02:35:47.000Z"
    },
    {
      "id": "cust_1764767405527_ztl4xx",
      "name": "Sophie Weber",
      "phone": "2815087222",
      "email": "",
      "zipCode": "70803",
      "vehicles": [
        "Toyato 4 runner"
      ],
      "totalBookings": 1,
      "totalSpent": 0,
      "firstVisit": "11/02/2025 7:37:00 pm",
      "lastVisit": "11/02/2025 7:37:00 pm",
      "status": "active",
      "createdAt": "2025-11-02T19:37:00.000Z"
    },
    {
      "id": "cust_1764767405527_hfvo8v",
      "name": "Lauren Swartley",
      "phone": "2253623656",
      "email": "",
      "zipCode": "70806",
      "vehicles": [
        "Ford Edge"
      ],
      "totalBookings": 1,
      "totalSpent": 0,
      "firstVisit": "11/02/2025 6:38:04 pm",
      "lastVisit": "11/02/2025 6:38:04 pm",
      "status": "active",
      "createdAt": "2025-11-02T18:38:04.000Z"
    },
    {
      "id": "cust_1764767405527_ydddh9",
      "name": "Nandi L Shenkan",
      "phone": "3372966145",
      "email": "",
      "zipCode": "70809",
      "vehicles": [
        "2015 BMW 320i"
      ],
      "totalBookings": 1,
      "totalSpent": 0,
      "firstVisit": "10/30/2025 11:03:07 pm",
      "lastVisit": "10/30/2025 11:03:07 pm",
      "status": "active",
      "createdAt": "2025-10-30T23:03:07.000Z"
    },
    {
      "id": "cust_1764767405527_8gc7zp",
      "name": "Jonquail Smith",
      "phone": "2254287554",
      "email": "",
      "zipCode": "70812",
      "vehicles": [
        "Dodge avenger"
      ],
      "totalBookings": 1,
      "totalSpent": 0,
      "firstVisit": "10/28/2025 7:56:21 pm",
      "lastVisit": "10/28/2025 7:56:21 pm",
      "status": "active",
      "createdAt": "2025-10-28T19:56:21.000Z"
    },
    {
      "id": "cust_1764767405527_jh5nxa",
      "name": "Jeff Snell",
      "phone": "2252846234",
      "email": "",
      "zipCode": "70806",
      "vehicles": [
        "2014 Mitsubishi Outlander"
      ],
      "totalBookings": 1,
      "totalSpent": 0,
      "firstVisit": "10/27/2025 11:49:44 am",
      "lastVisit": "10/27/2025 11:49:44 am",
      "status": "active",
      "createdAt": "2025-10-27T11:49:44.000Z"
    },
    {
      "id": "cust_1764767405527_0mo6st",
      "name": "Kayleigh Pace",
      "phone": "3184238304",
      "email": "",
      "zipCode": "70816",
      "vehicles": [
        "Mazda Mazda6"
      ],
      "totalBookings": 1,
      "totalSpent": 0,
      "firstVisit": "10/27/2025 1:13:07 am",
      "lastVisit": "10/27/2025 1:13:07 am",
      "status": "active",
      "createdAt": "2025-10-27T01:13:07.000Z"
    },
    {
      "id": "cust_1764767405527_vsrgbj",
      "name": "Carolyn MC DONALD",
      "phone": "5048137114",
      "email": "",
      "zipCode": "70806",
      "vehicles": [
        "Mazda cx5 2024"
      ],
      "totalBookings": 1,
      "totalSpent": 0,
      "firstVisit": "10/26/2025 4:11:16 pm",
      "lastVisit": "10/26/2025 4:11:16 pm",
      "status": "active",
      "createdAt": "2025-10-26T16:11:16.000Z"
    },
    {
      "id": "cust_1764767405527_yi37ao",
      "name": "Brian Banta",
      "phone": "2255050140",
      "email": "",
      "zipCode": "70816",
      "vehicles": [
        "2025 Chevy Tahoe"
      ],
      "totalBookings": 1,
      "totalSpent": 0,
      "firstVisit": "10/25/2025 1:03:06 am",
      "lastVisit": "10/25/2025 1:03:06 am",
      "status": "active",
      "createdAt": "2025-10-25T01:03:06.000Z"
    },
    {
      "id": "cust_1764767405527_w1jq6v",
      "name": "Trey Wilson",
      "phone": "2252233438",
      "email": "",
      "zipCode": "70706",
      "vehicles": [
        "2025 Gmc Sierra At4"
      ],
      "totalBookings": 1,
      "totalSpent": 0,
      "firstVisit": "10/24/2025 8:22:28 am",
      "lastVisit": "10/24/2025 8:22:28 am",
      "status": "active",
      "createdAt": "2025-10-24T08:22:28.000Z"
    },
    {
      "id": "cust_1764767405527_48v5mw",
      "name": "Sophine Kevorkian",
      "phone": "8583447425",
      "email": "",
      "zipCode": "70820",
      "vehicles": [
        "BMW X3"
      ],
      "totalBookings": 2,
      "totalSpent": 0,
      "firstVisit": "10/23/2025 12:41:18 pm",
      "lastVisit": "04/29/2025 3:22:58 pm",
      "status": "active",
      "createdAt": "2025-10-23T12:41:18.000Z"
    },
    {
      "id": "cust_1764767405527_6thk8d",
      "name": "Aniya Hollins",
      "phone": "6018077648",
      "email": "",
      "zipCode": "70820",
      "vehicles": [
        "Nissan Sentra"
      ],
      "totalBookings": 1,
      "totalSpent": 0,
      "firstVisit": "10/21/2025 11:01:40 pm",
      "lastVisit": "10/21/2025 11:01:40 pm",
      "status": "active",
      "createdAt": "2025-10-21T23:01:40.000Z"
    },
    {
      "id": "cust_1764767405527_1udx6u",
      "name": "cierra booker",
      "phone": "5043571075",
      "email": "",
      "zipCode": "70810",
      "vehicles": [
        "huyndai kona"
      ],
      "totalBookings": 1,
      "totalSpent": 0,
      "firstVisit": "10/21/2025 1:28:29 pm",
      "lastVisit": "10/21/2025 1:28:29 pm",
      "status": "active",
      "createdAt": "2025-10-21T13:28:29.000Z"
    },
    {
      "id": "cust_1764767405527_w1a7f3",
      "name": "Carly Hebert",
      "phone": "2252879733",
      "email": "",
      "zipCode": "70737",
      "vehicles": [
        "2014 Buick Enclave"
      ],
      "totalBookings": 1,
      "totalSpent": 0,
      "firstVisit": "10/19/2025 8:25:43 pm",
      "lastVisit": "10/19/2025 8:25:43 pm",
      "status": "active",
      "createdAt": "2025-10-19T20:25:43.000Z"
    },
    {
      "id": "cust_1764767405527_ch5nb2",
      "name": "William Ashman",
      "phone": "9853128439",
      "email": "",
      "zipCode": "70817",
      "vehicles": [
        "Dodge Journey"
      ],
      "totalBookings": 1,
      "totalSpent": 0,
      "firstVisit": "10/19/2025 12:12:14 pm",
      "lastVisit": "10/19/2025 12:12:14 pm",
      "status": "active",
      "createdAt": "2025-10-19T12:12:14.000Z"
    },
    {
      "id": "cust_1764767405527_992283",
      "name": "Jackson Murray",
      "phone": "5042891923",
      "email": "",
      "zipCode": "70803",
      "vehicles": [
        "2020 Ford Raptor"
      ],
      "totalBookings": 1,
      "totalSpent": 0,
      "firstVisit": "10/17/2025 7:28:11 pm",
      "lastVisit": "10/17/2025 7:28:11 pm",
      "status": "active",
      "createdAt": "2025-10-17T19:28:11.000Z"
    },
    {
      "id": "cust_1764767405527_3fp6na",
      "name": "Keaira Woodard",
      "phone": "8555174436",
      "email": "",
      "zipCode": "70811",
      "vehicles": [
        "Nissan Pathfinder"
      ],
      "totalBookings": 1,
      "totalSpent": 0,
      "firstVisit": "10/16/2025 5:09:41 pm",
      "lastVisit": "10/16/2025 5:09:41 pm",
      "status": "active",
      "createdAt": "2025-10-16T17:09:41.000Z"
    },
    {
      "id": "cust_1764767405527_s7h5jj",
      "name": "Amanda Jones",
      "phone": "2256037619",
      "email": "",
      "zipCode": "70714",
      "vehicles": [
        "22 ford bronco 4 door soft top"
      ],
      "totalBookings": 1,
      "totalSpent": 0,
      "firstVisit": "10/13/2025 5:11:01 pm",
      "lastVisit": "10/13/2025 5:11:01 pm",
      "status": "active",
      "createdAt": "2025-10-13T17:11:01.000Z"
    },
    {
      "id": "cust_1764767405527_iet9zq",
      "name": "Carlos",
      "phone": "2544830065",
      "email": "",
      "zipCode": "70809",
      "vehicles": [
        "17 Honda Civic sedan cloth interior"
      ],
      "totalBookings": 1,
      "totalSpent": 0,
      "firstVisit": "10/13/2025 2:41:57 pm",
      "lastVisit": "10/13/2025 2:41:57 pm",
      "status": "active",
      "createdAt": "2025-10-13T14:41:57.000Z"
    },
    {
      "id": "cust_1764767405527_q5alvr",
      "name": "Alvin Golden",
      "phone": "9854001799",
      "email": "",
      "zipCode": "70810",
      "vehicles": [
        "Nissan Marrano"
      ],
      "totalBookings": 1,
      "totalSpent": 0,
      "firstVisit": "10/11/2025 9:02:31 pm",
      "lastVisit": "10/11/2025 9:02:31 pm",
      "status": "active",
      "createdAt": "2025-10-11T21:02:31.000Z"
    },
    {
      "id": "cust_1764767405528_mqarjk",
      "name": "Sheila Hopkins",
      "phone": "7202529098",
      "email": "",
      "zipCode": "70810",
      "vehicles": [
        "2015 Honda odyssey elite"
      ],
      "totalBookings": 1,
      "totalSpent": 0,
      "firstVisit": "10/10/2025 12:52:17 am",
      "lastVisit": "10/10/2025 12:52:17 am",
      "status": "active",
      "createdAt": "2025-10-10T00:52:17.000Z"
    },
    {
      "id": "cust_1764767405528_dnmajx",
      "name": "Morgan Scott",
      "phone": "2255039158",
      "email": "",
      "zipCode": "70816",
      "vehicles": [
        "2014 Silverado 1500"
      ],
      "totalBookings": 1,
      "totalSpent": 0,
      "firstVisit": "10/08/2025 3:57:47 pm",
      "lastVisit": "10/08/2025 3:57:47 pm",
      "status": "active",
      "createdAt": "2025-10-08T15:57:47.000Z"
    },
    {
      "id": "cust_1764767405528_6w2giv",
      "name": "Cody Lemoine",
      "phone": "3183591991",
      "email": "",
      "zipCode": "70808",
      "vehicles": [
        "2024 Chevy Colorado With Camper Shell on bed"
      ],
      "totalBookings": 1,
      "totalSpent": 0,
      "firstVisit": "10/07/2025 2:43:58 pm",
      "lastVisit": "10/07/2025 2:43:58 pm",
      "status": "active",
      "createdAt": "2025-10-07T14:43:58.000Z"
    },
    {
      "id": "cust_1764767405528_v9gi5g",
      "name": "Dexter Henderson",
      "phone": "5126537070",
      "email": "",
      "zipCode": "70807",
      "vehicles": [
        "Mercedes c300"
      ],
      "totalBookings": 1,
      "totalSpent": 0,
      "firstVisit": "10/05/2025 3:57:52 am",
      "lastVisit": "10/05/2025 3:57:52 am",
      "status": "active",
      "createdAt": "2025-10-05T03:57:52.000Z"
    },
    {
      "id": "cust_1764767405528_k9s8qa",
      "name": "Claire Bernard",
      "phone": "5946881392",
      "email": "",
      "zipCode": "N/A",
      "vehicles": [],
      "totalBookings": 1,
      "totalSpent": 0,
      "firstVisit": "10/03/2025 6:20:52 am",
      "lastVisit": "10/03/2025 6:20:52 am",
      "status": "active",
      "createdAt": "2025-10-03T06:20:52.000Z"
    },
    {
      "id": "cust_1764767405528_q9rgna",
      "name": "Joanna Redmond",
      "phone": "2255726284",
      "email": "",
      "zipCode": "70818",
      "vehicles": [
        "Hyundai Palisade"
      ],
      "totalBookings": 1,
      "totalSpent": 0,
      "firstVisit": "10/02/2025 2:55:18 pm",
      "lastVisit": "10/02/2025 2:55:18 pm",
      "status": "active",
      "createdAt": "2025-10-02T14:55:18.000Z"
    },
    {
      "id": "cust_1764767405528_yaijli",
      "name": "Aimee Williams",
      "phone": "6608645404",
      "email": "",
      "zipCode": "70808",
      "vehicles": [
        "2017 hyundia elantra",
        "Hyundai Elantra"
      ],
      "totalBookings": 2,
      "totalSpent": 0,
      "firstVisit": "10/01/2025 8:58:59 pm",
      "lastVisit": "12/07/2024 6:27:43 pm",
      "status": "active",
      "createdAt": "2025-10-01T20:58:59.000Z"
    },
    {
      "id": "cust_1764767405528_8qm1hl",
      "name": "PJ McCormick",
      "phone": "7028855124",
      "email": "",
      "zipCode": "70801",
      "vehicles": [
        "VW Beetle Convertible"
      ],
      "totalBookings": 1,
      "totalSpent": 0,
      "firstVisit": "10/01/2025 7:31:42 pm",
      "lastVisit": "10/01/2025 7:31:42 pm",
      "status": "active",
      "createdAt": "2025-10-01T19:31:42.000Z"
    },
    {
      "id": "cust_1764767405528_5w2io6",
      "name": "Maurice Hall",
      "phone": "2258106870",
      "email": "",
      "zipCode": "70764",
      "vehicles": [
        "Cadillac"
      ],
      "totalBookings": 1,
      "totalSpent": 0,
      "firstVisit": "10/01/2025 2:12:13 pm",
      "lastVisit": "10/01/2025 2:12:13 pm",
      "status": "active",
      "createdAt": "2025-10-01T14:12:13.000Z"
    },
    {
      "id": "cust_1764767405528_1hye3d",
      "name": "Reid Kiger",
      "phone": "2254313669",
      "email": "",
      "zipCode": "70769",
      "vehicles": [
        "2021 Ford Ranger"
      ],
      "totalBookings": 1,
      "totalSpent": 0,
      "firstVisit": "10/01/2025 2:33:25 am",
      "lastVisit": "10/01/2025 2:33:25 am",
      "status": "active",
      "createdAt": "2025-10-01T02:33:25.000Z"
    },
    {
      "id": "cust_1764767405528_vmbk9n",
      "name": "Mary Smith",
      "phone": "2253293722",
      "email": "",
      "zipCode": "70739",
      "vehicles": [
        "Audi Q8"
      ],
      "totalBookings": 1,
      "totalSpent": 0,
      "firstVisit": "09/30/2025 8:07:58 pm",
      "lastVisit": "09/30/2025 8:07:58 pm",
      "status": "active",
      "createdAt": "2025-09-30T20:07:58.000Z"
    },
    {
      "id": "cust_1764767405528_3wv9fq",
      "name": "Nodea Sewell",
      "phone": "6018070060",
      "email": "",
      "zipCode": "70813-0001",
      "vehicles": [
        "Toyota RAV4"
      ],
      "totalBookings": 1,
      "totalSpent": 0,
      "firstVisit": "09/30/2025 1:37:02 am",
      "lastVisit": "09/30/2025 1:37:02 am",
      "status": "active",
      "createdAt": "2025-09-30T01:37:02.000Z"
    },
    {
      "id": "cust_1764767405528_v94gpl",
      "name": "Mitchell Hymowitz",
      "phone": "3104066750",
      "email": "",
      "zipCode": "70809",
      "vehicles": [
        "Porsche Cayman T 2022"
      ],
      "totalBookings": 1,
      "totalSpent": 0,
      "firstVisit": "09/29/2025 10:14:16 pm",
      "lastVisit": "09/29/2025 10:14:16 pm",
      "status": "active",
      "createdAt": "2025-09-29T22:14:16.000Z"
    },
    {
      "id": "cust_1764767405528_ruwwvc",
      "name": "Faith Gates",
      "phone": "2255039932",
      "email": "",
      "zipCode": "70810",
      "vehicles": [
        "Toyota Camry"
      ],
      "totalBookings": 1,
      "totalSpent": 0,
      "firstVisit": "09/29/2025 6:52:18 pm",
      "lastVisit": "09/29/2025 6:52:18 pm",
      "status": "active",
      "createdAt": "2025-09-29T18:52:18.000Z"
    },
    {
      "id": "cust_1764767405528_2w79y4",
      "name": "Lauryn Porter",
      "phone": "6013823805",
      "email": "",
      "zipCode": "70809",
      "vehicles": [
        "Ford Ranger"
      ],
      "totalBookings": 1,
      "totalSpent": 0,
      "firstVisit": "09/25/2025 6:29:43 pm",
      "lastVisit": "09/25/2025 6:29:43 pm",
      "status": "active",
      "createdAt": "2025-09-25T18:29:43.000Z"
    },
    {
      "id": "cust_1764767405528_n6oh4i",
      "name": "Jessica Andry",
      "phone": "3182825121",
      "email": "",
      "zipCode": "79817",
      "vehicles": [
        "Chevrolet Tahoe"
      ],
      "totalBookings": 1,
      "totalSpent": 0,
      "firstVisit": "09/23/2025 3:05:34 pm",
      "lastVisit": "09/23/2025 3:05:34 pm",
      "status": "active",
      "createdAt": "2025-09-23T15:05:34.000Z"
    },
    {
      "id": "cust_1764767405528_tokhsd",
      "name": "Wrenn patterson",
      "phone": "9855181672",
      "email": "",
      "zipCode": "70817",
      "vehicles": [
        "Nissan maxima"
      ],
      "totalBookings": 1,
      "totalSpent": 0,
      "firstVisit": "09/23/2025 6:32:31 am",
      "lastVisit": "09/23/2025 6:32:31 am",
      "status": "active",
      "createdAt": "2025-09-23T06:32:31.000Z"
    },
    {
      "id": "cust_1764767405528_w87zqy",
      "name": "Ella Slack",
      "phone": "3187733619",
      "email": "",
      "zipCode": "70820",
      "vehicles": [
        "Mazda CX-5"
      ],
      "totalBookings": 1,
      "totalSpent": 0,
      "firstVisit": "09/22/2025 9:53:17 pm",
      "lastVisit": "09/22/2025 9:53:17 pm",
      "status": "active",
      "createdAt": "2025-09-22T21:53:17.000Z"
    },
    {
      "id": "cust_1764767405528_uipto2",
      "name": "Tremia Lockett",
      "phone": "2255737543",
      "email": "",
      "zipCode": "70726",
      "vehicles": [
        "Infiniti Q50"
      ],
      "totalBookings": 1,
      "totalSpent": 0,
      "firstVisit": "09/22/2025 2:39:00 pm",
      "lastVisit": "09/22/2025 2:39:00 pm",
      "status": "active",
      "createdAt": "2025-09-22T14:39:00.000Z"
    },
    {
      "id": "cust_1764767405528_scx74w",
      "name": "John Dunlap",
      "phone": "2259388814",
      "email": "",
      "zipCode": "70808",
      "vehicles": [
        "Cadillac Escalade"
      ],
      "totalBookings": 1,
      "totalSpent": 0,
      "firstVisit": "09/21/2025 10:47:37 pm",
      "lastVisit": "09/21/2025 10:47:37 pm",
      "status": "active",
      "createdAt": "2025-09-21T22:47:37.000Z"
    },
    {
      "id": "cust_1764767405528_x4o8k6",
      "name": "Crystal Lewis",
      "phone": "2253331351",
      "email": "",
      "zipCode": "70816",
      "vehicles": [
        "2013 Ford Escape"
      ],
      "totalBookings": 1,
      "totalSpent": 0,
      "firstVisit": "09/21/2025 4:07:45 pm",
      "lastVisit": "09/21/2025 4:07:45 pm",
      "status": "active",
      "createdAt": "2025-09-21T16:07:45.000Z"
    },
    {
      "id": "cust_1764767405528_armgbb",
      "name": "Liletha Tobias",
      "phone": "2259397269",
      "email": "",
      "zipCode": "70812",
      "vehicles": [
        "Mercedes C300"
      ],
      "totalBookings": 1,
      "totalSpent": 0,
      "firstVisit": "09/20/2025 4:51:08 pm",
      "lastVisit": "09/20/2025 4:51:08 pm",
      "status": "active",
      "createdAt": "2025-09-20T16:51:08.000Z"
    },
    {
      "id": "cust_1764767405528_azgjg4",
      "name": "Miya Jones",
      "phone": "9852229788",
      "email": "",
      "zipCode": "70819",
      "vehicles": [
        "2015 Honda Accord Sport"
      ],
      "totalBookings": 1,
      "totalSpent": 0,
      "firstVisit": "09/18/2025 10:59:02 pm",
      "lastVisit": "09/18/2025 10:59:02 pm",
      "status": "active",
      "createdAt": "2025-09-18T22:59:02.000Z"
    },
    {
      "id": "cust_1764767405528_520epl",
      "name": "KATY GUESSFELD",
      "phone": "2252441918",
      "email": "",
      "zipCode": "70809",
      "vehicles": [
        "2023 Camry TRD"
      ],
      "totalBookings": 1,
      "totalSpent": 0,
      "firstVisit": "09/18/2025 1:59:21 pm",
      "lastVisit": "09/18/2025 1:59:21 pm",
      "status": "active",
      "createdAt": "2025-09-18T13:59:21.000Z"
    },
    {
      "id": "cust_1764767405528_jvzvj6",
      "name": "Scott Doyle",
      "phone": "2255217788",
      "email": "",
      "zipCode": "70767",
      "vehicles": [
        "BMW 430i"
      ],
      "totalBookings": 1,
      "totalSpent": 0,
      "firstVisit": "09/17/2025 8:50:53 pm",
      "lastVisit": "09/17/2025 8:50:53 pm",
      "status": "active",
      "createdAt": "2025-09-17T20:50:53.000Z"
    },
    {
      "id": "cust_1764767405528_hkdm4i",
      "name": "Janee grant",
      "phone": "3375798459",
      "email": "",
      "zipCode": "70807",
      "vehicles": [
        "Honda civic"
      ],
      "totalBookings": 1,
      "totalSpent": 0,
      "firstVisit": "09/17/2025 1:28:17 pm",
      "lastVisit": "09/17/2025 1:28:17 pm",
      "status": "active",
      "createdAt": "2025-09-17T13:28:17.000Z"
    },
    {
      "id": "cust_1764767405528_nz6hpa",
      "name": "Paulyn Robinson",
      "phone": "3184026895",
      "email": "",
      "zipCode": "70820",
      "vehicles": [
        "Toyota Corolla"
      ],
      "totalBookings": 1,
      "totalSpent": 0,
      "firstVisit": "09/16/2025 8:16:36 pm",
      "lastVisit": "09/16/2025 8:16:36 pm",
      "status": "active",
      "createdAt": "2025-09-16T20:16:36.000Z"
    },
    {
      "id": "cust_1764767405528_bv8va4",
      "name": "Brendan mckenna",
      "phone": "9852101161",
      "email": "",
      "zipCode": "70809",
      "vehicles": [
        "2017 Toyota yaris"
      ],
      "totalBookings": 1,
      "totalSpent": 0,
      "firstVisit": "09/16/2025 1:30:39 pm",
      "lastVisit": "09/16/2025 1:30:39 pm",
      "status": "active",
      "createdAt": "2025-09-16T13:30:39.000Z"
    },
    {
      "id": "cust_1764767405528_lk66qo",
      "name": "Kelsey Jaye",
      "phone": "4175409771",
      "email": "",
      "zipCode": "70816",
      "vehicles": [
        "Nissan Versa Note"
      ],
      "totalBookings": 1,
      "totalSpent": 0,
      "firstVisit": "09/15/2025 6:47:23 pm",
      "lastVisit": "09/15/2025 6:47:23 pm",
      "status": "active",
      "createdAt": "2025-09-15T18:47:23.000Z"
    },
    {
      "id": "cust_1764767405528_ezyke1",
      "name": "Jarel Ford",
      "phone": "2253486128",
      "email": "",
      "zipCode": "70776",
      "vehicles": [
        "2021 Kia Telluride & 2019 Ford F150"
      ],
      "totalBookings": 1,
      "totalSpent": 0,
      "firstVisit": "09/15/2025 11:00:10 am",
      "lastVisit": "09/15/2025 11:00:10 am",
      "status": "active",
      "createdAt": "2025-09-15T11:00:10.000Z"
    },
    {
      "id": "cust_1764767405528_daja54",
      "name": "Marcus Chialastri",
      "phone": "2256147304",
      "email": "",
      "zipCode": "70809",
      "vehicles": [
        "2015 Honda Civic"
      ],
      "totalBookings": 1,
      "totalSpent": 0,
      "firstVisit": "09/15/2025 2:45:38 am",
      "lastVisit": "09/15/2025 2:45:38 am",
      "status": "active",
      "createdAt": "2025-09-15T02:45:38.000Z"
    },
    {
      "id": "cust_1764767405528_i1jpoq",
      "name": "La' Heaven James",
      "phone": "2252841632",
      "email": "",
      "zipCode": "70812",
      "vehicles": [
        "2022 buick encore GX"
      ],
      "totalBookings": 1,
      "totalSpent": 0,
      "firstVisit": "09/14/2025 10:39:29 pm",
      "lastVisit": "09/14/2025 10:39:29 pm",
      "status": "active",
      "createdAt": "2025-09-14T22:39:29.000Z"
    },
    {
      "id": "cust_1764767405528_seltn1",
      "name": "Tamera",
      "phone": "2252814534",
      "email": "",
      "zipCode": "70739",
      "vehicles": [
        "Toyota Corolla"
      ],
      "totalBookings": 2,
      "totalSpent": 0,
      "firstVisit": "09/14/2025 8:33:07 pm",
      "lastVisit": "09/13/2025 10:28:31 am",
      "status": "active",
      "createdAt": "2025-09-14T20:33:07.000Z"
    },
    {
      "id": "cust_1764767405528_lzqyx6",
      "name": "Ayanna Flye",
      "phone": "6789331829",
      "email": "",
      "zipCode": "70809",
      "vehicles": [
        "Nissan rogue sport"
      ],
      "totalBookings": 1,
      "totalSpent": 0,
      "firstVisit": "09/14/2025 8:25:56 pm",
      "lastVisit": "09/14/2025 8:25:56 pm",
      "status": "active",
      "createdAt": "2025-09-14T20:25:56.000Z"
    },
    {
      "id": "cust_1764767405528_0r76sh",
      "name": "Kellie Tortorich",
      "phone": "9852640472",
      "email": "",
      "zipCode": "70806",
      "vehicles": [
        "GMC Denali"
      ],
      "totalBookings": 1,
      "totalSpent": 0,
      "firstVisit": "09/14/2025 3:49:35 pm",
      "lastVisit": "09/14/2025 3:49:35 pm",
      "status": "active",
      "createdAt": "2025-09-14T15:49:35.000Z"
    },
    {
      "id": "cust_1764767405528_sxyuhm",
      "name": "Rebecca Smith",
      "phone": "5042755672",
      "email": "",
      "zipCode": "70809",
      "vehicles": [
        "2016 Toyota Corolla"
      ],
      "totalBookings": 1,
      "totalSpent": 0,
      "firstVisit": "09/14/2025 2:50:49 pm",
      "lastVisit": "09/14/2025 2:50:49 pm",
      "status": "active",
      "createdAt": "2025-09-14T14:50:49.000Z"
    },
    {
      "id": "cust_1764767405528_kuhqc9",
      "name": "Jacoby",
      "phone": "2252419264",
      "email": "",
      "zipCode": "70805",
      "vehicles": [
        "2017 Honda Civic"
      ],
      "totalBookings": 1,
      "totalSpent": 0,
      "firstVisit": "09/13/2025 2:17:44 pm",
      "lastVisit": "09/13/2025 2:17:44 pm",
      "status": "active",
      "createdAt": "2025-09-13T14:17:44.000Z"
    },
    {
      "id": "cust_1764767405528_ue29ol",
      "name": "Robert Case",
      "phone": "2255356804",
      "email": "",
      "zipCode": "70812",
      "vehicles": [
        "Dodge Charger"
      ],
      "totalBookings": 1,
      "totalSpent": 0,
      "firstVisit": "09/12/2025 11:33:40 am",
      "lastVisit": "09/12/2025 11:33:40 am",
      "status": "active",
      "createdAt": "2025-09-12T11:33:40.000Z"
    },
    {
      "id": "cust_1764767405528_7b8wn1",
      "name": "Christopher Cole",
      "phone": "2253648850",
      "email": "",
      "zipCode": "70726",
      "vehicles": [
        "Dodge Ram 2500"
      ],
      "totalBookings": 1,
      "totalSpent": 0,
      "firstVisit": "09/11/2025 3:19:29 pm",
      "lastVisit": "09/11/2025 3:19:29 pm",
      "status": "active",
      "createdAt": "2025-09-11T15:19:29.000Z"
    },
    {
      "id": "cust_1764767405528_e9jh3y",
      "name": "Phi Duong",
      "phone": "5042906482",
      "email": "",
      "zipCode": "70820",
      "vehicles": [
        "2017 Lexus Es350"
      ],
      "totalBookings": 1,
      "totalSpent": 0,
      "firstVisit": "09/10/2025 6:45:45 am",
      "lastVisit": "09/10/2025 6:45:45 am",
      "status": "active",
      "createdAt": "2025-09-10T06:45:45.000Z"
    },
    {
      "id": "cust_1764767405528_lw7o3m",
      "name": "Shiban Alheiidari",
      "phone": "2254019219",
      "email": "",
      "zipCode": "70764",
      "vehicles": [
        "Toyota Highlander"
      ],
      "totalBookings": 1,
      "totalSpent": 0,
      "firstVisit": "09/09/2025 11:23:03 pm",
      "lastVisit": "09/09/2025 11:23:03 pm",
      "status": "active",
      "createdAt": "2025-09-09T23:23:03.000Z"
    },
    {
      "id": "cust_1764767405528_tr6940",
      "name": "Jeanneen Higgins",
      "phone": "2254056097",
      "email": "",
      "zipCode": "70809",
      "vehicles": [
        "2020 Acura RDX"
      ],
      "totalBookings": 1,
      "totalSpent": 0,
      "firstVisit": "09/09/2025 4:11:06 pm",
      "lastVisit": "09/09/2025 4:11:06 pm",
      "status": "active",
      "createdAt": "2025-09-09T16:11:06.000Z"
    },
    {
      "id": "cust_1764767405528_2detfh",
      "name": "Ariel MBride",
      "phone": "2254092000",
      "email": "",
      "zipCode": "70816",
      "vehicles": [
        "Jeep Wrangler JL"
      ],
      "totalBookings": 1,
      "totalSpent": 0,
      "firstVisit": "09/08/2025 8:46:59 pm",
      "lastVisit": "09/08/2025 8:46:59 pm",
      "status": "active",
      "createdAt": "2025-09-08T20:46:59.000Z"
    },
    {
      "id": "cust_1764767405528_oxyh7e",
      "name": "Maria DeLouise",
      "phone": "2259397877",
      "email": "",
      "zipCode": "70810",
      "vehicles": [
        "Lexus 350"
      ],
      "totalBookings": 1,
      "totalSpent": 0,
      "firstVisit": "09/08/2025 5:19:10 pm",
      "lastVisit": "09/08/2025 5:19:10 pm",
      "status": "active",
      "createdAt": "2025-09-08T17:19:10.000Z"
    },
    {
      "id": "cust_1764767405528_64psmt",
      "name": "Joey Capone",
      "phone": "2252475530",
      "email": "",
      "zipCode": "70820",
      "vehicles": [
        "2025 chevrolet silverado",
        "2020 Chevy Silverado"
      ],
      "totalBookings": 2,
      "totalSpent": 0,
      "firstVisit": "09/07/2025 5:37:04 am",
      "lastVisit": "08/27/2025 4:53:07 pm",
      "status": "active",
      "createdAt": "2025-09-07T05:37:04.000Z"
    },
    {
      "id": "cust_1764767405528_emax6b",
      "name": "Kohen Thompson",
      "phone": "9015909552",
      "email": "",
      "zipCode": "70808",
      "vehicles": [
        "Chevy Camaro"
      ],
      "totalBookings": 1,
      "totalSpent": 0,
      "firstVisit": "09/04/2025 2:01:16 am",
      "lastVisit": "09/04/2025 2:01:16 am",
      "status": "active",
      "createdAt": "2025-09-04T02:01:16.000Z"
    },
    {
      "id": "cust_1764767405528_dmv03y",
      "name": "Leon Daquin",
      "phone": "2255054923",
      "email": "",
      "zipCode": "70808",
      "vehicles": [
        "2016 Ford Explorer"
      ],
      "totalBookings": 1,
      "totalSpent": 0,
      "firstVisit": "09/04/2025 1:12:34 am",
      "lastVisit": "09/04/2025 1:12:34 am",
      "status": "active",
      "createdAt": "2025-09-04T01:12:34.000Z"
    },
    {
      "id": "cust_1764767405528_6xiixy",
      "name": "Andy Johnson",
      "phone": "3373703035",
      "email": "",
      "zipCode": "70806",
      "vehicles": [
        "2021 Honda Accord Hybrid"
      ],
      "totalBookings": 1,
      "totalSpent": 0,
      "firstVisit": "09/03/2025 5:33:45 pm",
      "lastVisit": "09/03/2025 5:33:45 pm",
      "status": "active",
      "createdAt": "2025-09-03T17:33:45.000Z"
    },
    {
      "id": "cust_1764767405529_a0r4cw",
      "name": "Hudson Kirkpatrick",
      "phone": "2252763754",
      "email": "",
      "zipCode": "70809",
      "vehicles": [
        "2012 Ford Escape"
      ],
      "totalBookings": 1,
      "totalSpent": 0,
      "firstVisit": "09/01/2025 4:18:41 am",
      "lastVisit": "09/01/2025 4:18:41 am",
      "status": "active",
      "createdAt": "2025-09-01T04:18:41.000Z"
    },
    {
      "id": "cust_1764767405529_2280uu",
      "name": "Christian",
      "phone": "2259994897",
      "email": "",
      "zipCode": "70816",
      "vehicles": [
        "Toyota Camry 20013"
      ],
      "totalBookings": 1,
      "totalSpent": 0,
      "firstVisit": "08/31/2025 8:14:51 pm",
      "lastVisit": "08/31/2025 8:14:51 pm",
      "status": "active",
      "createdAt": "2025-08-31T20:14:51.000Z"
    },
    {
      "id": "cust_1764767405529_i5h6de",
      "name": "TERRANCE SCOTT",
      "phone": "2257470173",
      "email": "",
      "zipCode": "70769",
      "vehicles": [
        "2023 dodge charger gt"
      ],
      "totalBookings": 1,
      "totalSpent": 0,
      "firstVisit": "08/31/2025 1:17:12 pm",
      "lastVisit": "08/31/2025 1:17:12 pm",
      "status": "active",
      "createdAt": "2025-08-31T13:17:12.000Z"
    },
    {
      "id": "cust_1764767405529_6d0lhb",
      "name": "Matt Hebert",
      "phone": "2252525081",
      "email": "",
      "zipCode": "70816",
      "vehicles": [
        "2021 Honda CR-V EX (Red, cloth seats)"
      ],
      "totalBookings": 1,
      "totalSpent": 0,
      "firstVisit": "08/30/2025 10:43:36 pm",
      "lastVisit": "08/30/2025 10:43:36 pm",
      "status": "active",
      "createdAt": "2025-08-30T22:43:36.000Z"
    },
    {
      "id": "cust_1764767405529_b8n3gr",
      "name": "Maureen Johnson",
      "phone": "5743448085",
      "email": "",
      "zipCode": "70808",
      "vehicles": [
        "GMC Yukon 2021"
      ],
      "totalBookings": 1,
      "totalSpent": 0,
      "firstVisit": "08/30/2025 9:42:49 pm",
      "lastVisit": "08/30/2025 9:42:49 pm",
      "status": "active",
      "createdAt": "2025-08-30T21:42:49.000Z"
    },
    {
      "id": "cust_1764767405529_mamf5s",
      "name": "Seth Jackson",
      "phone": "5044308617",
      "email": "",
      "zipCode": "70803",
      "vehicles": [
        "2017 Dodge Charger SE"
      ],
      "totalBookings": 1,
      "totalSpent": 0,
      "firstVisit": "08/30/2025 5:07:39 pm",
      "lastVisit": "08/30/2025 5:07:39 pm",
      "status": "active",
      "createdAt": "2025-08-30T17:07:39.000Z"
    },
    {
      "id": "cust_1764767405530_5acogv",
      "name": "Michelle Valverde",
      "phone": "2259534546",
      "email": "",
      "zipCode": "70817",
      "vehicles": [
        "Lincoln Navigator"
      ],
      "totalBookings": 1,
      "totalSpent": 0,
      "firstVisit": "08/29/2025 12:35:12 pm",
      "lastVisit": "08/29/2025 12:35:12 pm",
      "status": "active",
      "createdAt": "2025-08-29T12:35:12.000Z"
    },
    {
      "id": "cust_1764767405530_yq7utw",
      "name": "Ty Fogleman",
      "phone": "3373021717",
      "email": "",
      "zipCode": "70820",
      "vehicles": [
        "Ford Pickup - F150"
      ],
      "totalBookings": 1,
      "totalSpent": 0,
      "firstVisit": "08/28/2025 4:49:57 pm",
      "lastVisit": "08/28/2025 4:49:57 pm",
      "status": "active",
      "createdAt": "2025-08-28T16:49:57.000Z"
    },
    {
      "id": "cust_1764767405530_4nh22a",
      "name": "Jeremiah Willis",
      "phone": "2257210950",
      "email": "",
      "zipCode": "70806",
      "vehicles": [
        "Mazda MX5"
      ],
      "totalBookings": 1,
      "totalSpent": 0,
      "firstVisit": "08/27/2025 7:26:10 pm",
      "lastVisit": "08/27/2025 7:26:10 pm",
      "status": "active",
      "createdAt": "2025-08-27T19:26:10.000Z"
    },
    {
      "id": "cust_1764767405530_xrshij",
      "name": "Gabriella",
      "phone": "3183552157",
      "email": "",
      "zipCode": "70806",
      "vehicles": [
        "Honda Accent"
      ],
      "totalBookings": 1,
      "totalSpent": 0,
      "firstVisit": "08/27/2025 5:34:44 am",
      "lastVisit": "08/27/2025 5:34:44 am",
      "status": "active",
      "createdAt": "2025-08-27T05:34:44.000Z"
    },
    {
      "id": "cust_1764767405530_dm4vff",
      "name": "Kaleigh Fleming",
      "phone": "7707976828",
      "email": "",
      "zipCode": "70803",
      "vehicles": [
        "Volkswagen Atlas Crossport"
      ],
      "totalBookings": 1,
      "totalSpent": 0,
      "firstVisit": "08/26/2025 11:22:32 pm",
      "lastVisit": "08/26/2025 11:22:32 pm",
      "status": "active",
      "createdAt": "2025-08-26T23:22:32.000Z"
    },
    {
      "id": "cust_1764767405530_nvgmpk",
      "name": "Jared Abram",
      "phone": "2254507490",
      "email": "",
      "zipCode": "70810",
      "vehicles": [
        "Toyota Tundra"
      ],
      "totalBookings": 1,
      "totalSpent": 0,
      "firstVisit": "08/25/2025 12:28:25 am",
      "lastVisit": "08/25/2025 12:28:25 am",
      "status": "active",
      "createdAt": "2025-08-25T00:28:25.000Z"
    },
    {
      "id": "cust_1764767405530_gbkjxe",
      "name": "Jada",
      "phone": "5043776249",
      "email": "",
      "zipCode": "70805",
      "vehicles": [
        "2009 Lexus ES 350"
      ],
      "totalBookings": 1,
      "totalSpent": 0,
      "firstVisit": "08/24/2025 10:58:03 pm",
      "lastVisit": "08/24/2025 10:58:03 pm",
      "status": "active",
      "createdAt": "2025-08-24T22:58:03.000Z"
    },
    {
      "id": "cust_1764767405530_10rxbl",
      "name": "Chris Pike",
      "phone": "2252793160",
      "email": "",
      "zipCode": "70809",
      "vehicles": [
        "2021 Acura RDX"
      ],
      "totalBookings": 1,
      "totalSpent": 0,
      "firstVisit": "08/23/2025 12:58:23 pm",
      "lastVisit": "08/23/2025 12:58:23 pm",
      "status": "active",
      "createdAt": "2025-08-23T12:58:23.000Z"
    },
    {
      "id": "cust_1764767405530_5w1wl4",
      "name": "Shonique Miller",
      "phone": "2252500238",
      "email": "",
      "zipCode": "70809",
      "vehicles": [
        "Honda CRC"
      ],
      "totalBookings": 1,
      "totalSpent": 0,
      "firstVisit": "08/23/2025 5:15:34 am",
      "lastVisit": "08/23/2025 5:15:34 am",
      "status": "active",
      "createdAt": "2025-08-23T05:15:34.000Z"
    },
    {
      "id": "cust_1764767405530_enbzk1",
      "name": "Michael Holmes Cooper",
      "phone": "4043027234",
      "email": "",
      "zipCode": "70808",
      "vehicles": [
        "2006 BMW 3309"
      ],
      "totalBookings": 1,
      "totalSpent": 0,
      "firstVisit": "08/22/2025 6:47:03 pm",
      "lastVisit": "08/22/2025 6:47:03 pm",
      "status": "active",
      "createdAt": "2025-08-22T18:47:03.000Z"
    },
    {
      "id": "cust_1764767405530_2v43xw",
      "name": "Hunter callihan",
      "phone": "2252477290",
      "email": "",
      "zipCode": "70818",
      "vehicles": [
        "2025 gmc sierra at4",
        "2011 Ford F150"
      ],
      "totalBookings": 2,
      "totalSpent": 0,
      "firstVisit": "08/22/2025 2:02:55 am",
      "lastVisit": "07/22/2025 2:56:24 pm",
      "status": "active",
      "createdAt": "2025-08-22T02:02:55.000Z"
    },
    {
      "id": "cust_1764767405530_v6rx8k",
      "name": "Franklin Ward",
      "phone": "3252030169",
      "email": "",
      "zipCode": "76801",
      "vehicles": [
        "Toyota Tundra Pro"
      ],
      "totalBookings": 1,
      "totalSpent": 0,
      "firstVisit": "08/22/2025 12:09:47 am",
      "lastVisit": "08/22/2025 12:09:47 am",
      "status": "active",
      "createdAt": "2025-08-22T00:09:47.000Z"
    },
    {
      "id": "cust_1764767405530_7f9mfj",
      "name": "Chris Galloway",
      "phone": "2253241998",
      "email": "",
      "zipCode": "70806",
      "vehicles": [
        "Ford Expedition"
      ],
      "totalBookings": 1,
      "totalSpent": 0,
      "firstVisit": "08/21/2025 9:49:53 pm",
      "lastVisit": "08/21/2025 9:49:53 pm",
      "status": "active",
      "createdAt": "2025-08-21T21:49:53.000Z"
    },
    {
      "id": "cust_1764767405530_njy1gm",
      "name": "Bret Persica",
      "phone": "2259390698",
      "email": "",
      "zipCode": "70820",
      "vehicles": [
        "Toyota tundra"
      ],
      "totalBookings": 1,
      "totalSpent": 0,
      "firstVisit": "08/20/2025 8:57:38 pm",
      "lastVisit": "08/20/2025 8:57:38 pm",
      "status": "active",
      "createdAt": "2025-08-20T20:57:38.000Z"
    },
    {
      "id": "cust_1764767405530_793xby",
      "name": "Thomas vige",
      "phone": "2254131656",
      "email": "",
      "zipCode": "70726",
      "vehicles": [
        "Gmc canyon"
      ],
      "totalBookings": 1,
      "totalSpent": 0,
      "firstVisit": "08/20/2025 3:51:52 pm",
      "lastVisit": "08/20/2025 3:51:52 pm",
      "status": "active",
      "createdAt": "2025-08-20T15:51:52.000Z"
    },
    {
      "id": "cust_1764767405530_jnnajx",
      "name": "Shannon Johnson",
      "phone": "3182186902",
      "email": "",
      "zipCode": "70816",
      "vehicles": [
        "2015 Cadillac XT5, 2025 BMW X5"
      ],
      "totalBookings": 1,
      "totalSpent": 0,
      "firstVisit": "08/20/2025 4:58:32 am",
      "lastVisit": "08/20/2025 4:58:32 am",
      "status": "active",
      "createdAt": "2025-08-20T04:58:32.000Z"
    },
    {
      "id": "cust_1764767405530_gxhqm2",
      "name": "Jamie larry",
      "phone": "2256034728",
      "email": "",
      "zipCode": "70807",
      "vehicles": [
        "2018 Honda Accord"
      ],
      "totalBookings": 1,
      "totalSpent": 0,
      "firstVisit": "08/19/2025 4:39:43 pm",
      "lastVisit": "08/19/2025 4:39:43 pm",
      "status": "active",
      "createdAt": "2025-08-19T16:39:43.000Z"
    },
    {
      "id": "cust_1764767405530_9bajhr",
      "name": "Anaya Williams",
      "phone": "3054691207",
      "email": "",
      "zipCode": "70813",
      "vehicles": [
        "Nissan Altima Sedan"
      ],
      "totalBookings": 1,
      "totalSpent": 0,
      "firstVisit": "08/18/2025 4:56:31 pm",
      "lastVisit": "08/18/2025 4:56:31 pm",
      "status": "active",
      "createdAt": "2025-08-18T16:56:31.000Z"
    },
    {
      "id": "cust_1764767405530_2apd46",
      "name": "Olivia Redivo",
      "phone": "6026174672",
      "email": "",
      "zipCode": "92078",
      "vehicles": [
        "Acura Integra"
      ],
      "totalBookings": 1,
      "totalSpent": 0,
      "firstVisit": "08/18/2025 1:53:10 am",
      "lastVisit": "08/18/2025 1:53:10 am",
      "status": "active",
      "createdAt": "2025-08-18T01:53:10.000Z"
    },
    {
      "id": "cust_1764767405530_qrmaaq",
      "name": "Shaniya Marable",
      "phone": "2257171710",
      "email": "",
      "zipCode": "70809",
      "vehicles": [
        "Honda Civic"
      ],
      "totalBookings": 1,
      "totalSpent": 0,
      "firstVisit": "08/17/2025 7:06:52 pm",
      "lastVisit": "08/17/2025 7:06:52 pm",
      "status": "active",
      "createdAt": "2025-08-17T19:06:52.000Z"
    },
    {
      "id": "cust_1764767405530_6qrb1d",
      "name": "Jill Woods",
      "phone": "9852122014",
      "email": "",
      "zipCode": "70810",
      "vehicles": [
        "Honda Pilot Elite 2019"
      ],
      "totalBookings": 1,
      "totalSpent": 0,
      "firstVisit": "08/17/2025 4:34:00 pm",
      "lastVisit": "08/17/2025 4:34:00 pm",
      "status": "active",
      "createdAt": "2025-08-17T16:34:00.000Z"
    },
    {
      "id": "cust_1764767405530_34yqen",
      "name": "Dorian Whiten",
      "phone": "4153078578",
      "email": "",
      "zipCode": "70820",
      "vehicles": [
        "2015 Toyota RAV4"
      ],
      "totalBookings": 1,
      "totalSpent": 0,
      "firstVisit": "08/17/2025 4:31:18 pm",
      "lastVisit": "08/17/2025 4:31:18 pm",
      "status": "active",
      "createdAt": "2025-08-17T16:31:18.000Z"
    },
    {
      "id": "cust_1764767405530_8nl89r",
      "name": "Jerry Kincheloe",
      "phone": "3083252428",
      "email": "",
      "zipCode": "70772",
      "vehicles": [
        "2020 Chevrolet Silverado 3500 high country"
      ],
      "totalBookings": 1,
      "totalSpent": 0,
      "firstVisit": "08/17/2025 2:36:59 pm",
      "lastVisit": "08/17/2025 2:36:59 pm",
      "status": "active",
      "createdAt": "2025-08-17T14:36:59.000Z"
    },
    {
      "id": "cust_1764767405530_2hehxf",
      "name": "Johnathan Hunter",
      "phone": "7575568459",
      "email": "",
      "zipCode": "70737",
      "vehicles": [
        "Harley Davidson Lowrider"
      ],
      "totalBookings": 1,
      "totalSpent": 0,
      "firstVisit": "08/17/2025 6:48:17 am",
      "lastVisit": "08/17/2025 6:48:17 am",
      "status": "active",
      "createdAt": "2025-08-17T06:48:17.000Z"
    },
    {
      "id": "cust_1764767405530_s1zecy",
      "name": "Darrick Bell",
      "phone": "2256150276",
      "email": "",
      "zipCode": "70791",
      "vehicles": [
        "2023 Ram 1500"
      ],
      "totalBookings": 1,
      "totalSpent": 0,
      "firstVisit": "08/17/2025 12:03:23 am",
      "lastVisit": "08/17/2025 12:03:23 am",
      "status": "active",
      "createdAt": "2025-08-17T00:03:23.000Z"
    },
    {
      "id": "cust_1764767405530_i8mt7c",
      "name": "Jeremiah Phillips",
      "phone": "2252870043",
      "email": "",
      "zipCode": "70737",
      "vehicles": [
        "Jeep Wrangler"
      ],
      "totalBookings": 1,
      "totalSpent": 0,
      "firstVisit": "08/16/2025 3:21:06 pm",
      "lastVisit": "08/16/2025 3:21:06 pm",
      "status": "active",
      "createdAt": "2025-08-16T15:21:06.000Z"
    },
    {
      "id": "cust_1764767405530_b02cdp",
      "name": "Chantae Haliburton",
      "phone": "2253648085",
      "email": "",
      "zipCode": "70820",
      "vehicles": [
        "2023 Nissan Ayria Evolve"
      ],
      "totalBookings": 1,
      "totalSpent": 0,
      "firstVisit": "08/16/2025 12:38:34 pm",
      "lastVisit": "08/16/2025 12:38:34 pm",
      "status": "active",
      "createdAt": "2025-08-16T12:38:34.000Z"
    },
    {
      "id": "cust_1764767405530_9ksy2b",
      "name": "Latif Mohamed",
      "phone": "2259752865",
      "email": "",
      "zipCode": "70810",
      "vehicles": [
        "2023 chevy camaro"
      ],
      "totalBookings": 1,
      "totalSpent": 0,
      "firstVisit": "08/15/2025 7:52:27 pm",
      "lastVisit": "08/15/2025 7:52:27 pm",
      "status": "active",
      "createdAt": "2025-08-15T19:52:27.000Z"
    },
    {
      "id": "cust_1764767405530_5vk3g8",
      "name": "Roshon Cody",
      "phone": "2256146842",
      "email": "",
      "zipCode": "70817",
      "vehicles": [
        "Jaguar FPace and Tesla Model Y",
        "2024 Jaguar F Pace",
        "Jaguar F Pace"
      ],
      "totalBookings": 3,
      "totalSpent": 0,
      "firstVisit": "08/14/2025 4:37:39 am",
      "lastVisit": "06/28/2025 6:13:18 pm",
      "status": "active",
      "createdAt": "2025-08-14T04:37:39.000Z"
    },
    {
      "id": "cust_1764767405530_0qeo3o",
      "name": "Douglas K Waddell",
      "phone": "8505914077",
      "email": "",
      "zipCode": "70817",
      "vehicles": [
        "2023 Infiniti QX60"
      ],
      "totalBookings": 1,
      "totalSpent": 0,
      "firstVisit": "08/13/2025 9:16:10 pm",
      "lastVisit": "08/13/2025 9:16:10 pm",
      "status": "active",
      "createdAt": "2025-08-13T21:16:10.000Z"
    },
    {
      "id": "cust_1764767405530_tcjxdm",
      "name": "Austin Joppru",
      "phone": "2188660133",
      "email": "",
      "zipCode": "70816",
      "vehicles": [
        "Honda CRV 2020",
        "2018 Forest Green Honda HRV"
      ],
      "totalBookings": 2,
      "totalSpent": 0,
      "firstVisit": "08/12/2025 3:11:45 pm",
      "lastVisit": "07/01/2025 1:36:34 pm",
      "status": "active",
      "createdAt": "2025-08-12T15:11:45.000Z"
    },
    {
      "id": "cust_1764767405531_apgw3o",
      "name": "Doug Burgin",
      "phone": "2258927394",
      "email": "",
      "zipCode": "70817",
      "vehicles": [
        "Honda Fit"
      ],
      "totalBookings": 1,
      "totalSpent": 0,
      "firstVisit": "08/11/2025 11:51:03 am",
      "lastVisit": "08/11/2025 11:51:03 am",
      "status": "active",
      "createdAt": "2025-08-11T11:51:03.000Z"
    },
    {
      "id": "cust_1764767405531_765ns8",
      "name": "Dana Scott",
      "phone": "2252005220",
      "email": "",
      "zipCode": "70810",
      "vehicles": [
        "Ford F150"
      ],
      "totalBookings": 1,
      "totalSpent": 0,
      "firstVisit": "08/10/2025 9:34:23 pm",
      "lastVisit": "08/10/2025 9:34:23 pm",
      "status": "active",
      "createdAt": "2025-08-10T21:34:23.000Z"
    },
    {
      "id": "cust_1764767405531_61rzoi",
      "name": "Dequincy Scott",
      "phone": "2253626373",
      "email": "",
      "zipCode": "70820",
      "vehicles": [
        "2001 ford mustang svt"
      ],
      "totalBookings": 1,
      "totalSpent": 0,
      "firstVisit": "08/10/2025 6:40:57 pm",
      "lastVisit": "08/10/2025 6:40:57 pm",
      "status": "active",
      "createdAt": "2025-08-10T18:40:57.000Z"
    },
    {
      "id": "cust_1764767405531_7o9ta3",
      "name": "Jared Selser",
      "phone": "2256038941",
      "email": "",
      "zipCode": "70806",
      "vehicles": [
        "1973 Ford F350"
      ],
      "totalBookings": 1,
      "totalSpent": 0,
      "firstVisit": "08/10/2025 1:24:36 pm",
      "lastVisit": "08/10/2025 1:24:36 pm",
      "status": "active",
      "createdAt": "2025-08-10T13:24:36.000Z"
    },
    {
      "id": "cust_1764767405531_zvtz7h",
      "name": "Arzyonta Jarvis",
      "phone": "2254002492",
      "email": "",
      "zipCode": "70816",
      "vehicles": [
        "2015 camaro"
      ],
      "totalBookings": 1,
      "totalSpent": 0,
      "firstVisit": "08/09/2025 11:58:28 pm",
      "lastVisit": "08/09/2025 11:58:28 pm",
      "status": "active",
      "createdAt": "2025-08-09T23:58:28.000Z"
    },
    {
      "id": "cust_1764767405531_fkb0lz",
      "name": "Nathan Gary",
      "phone": "3372788465",
      "email": "",
      "zipCode": "70816",
      "vehicles": [
        "Cadillac Escalade"
      ],
      "totalBookings": 1,
      "totalSpent": 0,
      "firstVisit": "08/09/2025 6:35:40 pm",
      "lastVisit": "08/09/2025 6:35:40 pm",
      "status": "active",
      "createdAt": "2025-08-09T18:35:40.000Z"
    },
    {
      "id": "cust_1764767405531_xsgw9a",
      "name": "Matthew norton",
      "phone": "4433860266",
      "email": "",
      "zipCode": "70810",
      "vehicles": [
        "Vw altas and gmc sierra"
      ],
      "totalBookings": 1,
      "totalSpent": 0,
      "firstVisit": "08/09/2025 11:50:00 am",
      "lastVisit": "08/09/2025 11:50:00 am",
      "status": "active",
      "createdAt": "2025-08-09T11:50:00.000Z"
    },
    {
      "id": "cust_1764767405531_iatcqi",
      "name": "Willie",
      "phone": "2257727561",
      "email": "",
      "zipCode": "70808",
      "vehicles": [
        "Chev corvette"
      ],
      "totalBookings": 1,
      "totalSpent": 0,
      "firstVisit": "08/08/2025 10:04:49 am",
      "lastVisit": "08/08/2025 10:04:49 am",
      "status": "active",
      "createdAt": "2025-08-08T10:04:49.000Z"
    },
    {
      "id": "cust_1764767405531_xzzsz3",
      "name": "Keondra Jackson",
      "phone": "2254397509",
      "email": "",
      "zipCode": "70806",
      "vehicles": [
        "Honda according"
      ],
      "totalBookings": 1,
      "totalSpent": 0,
      "firstVisit": "08/05/2025 4:13:51 pm",
      "lastVisit": "08/05/2025 4:13:51 pm",
      "status": "active",
      "createdAt": "2025-08-05T16:13:51.000Z"
    },
    {
      "id": "cust_1764767405531_1ht2nj",
      "name": "Dionne Bell",
      "phone": "2254053903",
      "email": "",
      "zipCode": "70817",
      "vehicles": [
        "Mercedes G 550"
      ],
      "totalBookings": 1,
      "totalSpent": 0,
      "firstVisit": "08/05/2025 2:12:32 pm",
      "lastVisit": "08/05/2025 2:12:32 pm",
      "status": "active",
      "createdAt": "2025-08-05T14:12:32.000Z"
    },
    {
      "id": "cust_1764767405531_goqr13",
      "name": "Mark Cascio",
      "phone": "2259368508",
      "email": "",
      "zipCode": "70808",
      "vehicles": [
        "2013 Toyota Highlander"
      ],
      "totalBookings": 1,
      "totalSpent": 0,
      "firstVisit": "08/05/2025 12:39:13 am",
      "lastVisit": "08/05/2025 12:39:13 am",
      "status": "active",
      "createdAt": "2025-08-05T00:39:13.000Z"
    },
    {
      "id": "cust_1764767405531_uft1ek",
      "name": "Chelsea Friendship",
      "phone": "2257163237",
      "email": "",
      "zipCode": "70776",
      "vehicles": [
        "Toyota Rav4"
      ],
      "totalBookings": 1,
      "totalSpent": 0,
      "firstVisit": "08/04/2025 3:14:42 am",
      "lastVisit": "08/04/2025 3:14:42 am",
      "status": "active",
      "createdAt": "2025-08-04T03:14:42.000Z"
    },
    {
      "id": "cust_1764767405531_fgjp90",
      "name": "Kameron langlois",
      "phone": "225274655",
      "email": "",
      "zipCode": "70814",
      "vehicles": [
        "2017 toyota tacoma"
      ],
      "totalBookings": 1,
      "totalSpent": 0,
      "firstVisit": "08/02/2025 3:31:58 pm",
      "lastVisit": "08/02/2025 3:31:58 pm",
      "status": "active",
      "createdAt": "2025-08-02T15:31:58.000Z"
    },
    {
      "id": "cust_1764767405531_akvqlg",
      "name": "Keltrin Burrell II",
      "phone": "2253017388",
      "email": "",
      "zipCode": "70710",
      "vehicles": [
        "2018 Land Rover Discovery"
      ],
      "totalBookings": 1,
      "totalSpent": 0,
      "firstVisit": "07/31/2025 3:37:08 pm",
      "lastVisit": "07/31/2025 3:37:08 pm",
      "status": "active",
      "createdAt": "2025-07-31T15:37:08.000Z"
    },
    {
      "id": "cust_1764767405531_eunqw0",
      "name": "Gaston Daigle",
      "phone": "2252688099",
      "email": "",
      "zipCode": "70719",
      "vehicles": [
        "2025 Chevrolet Silverado 2500Hd"
      ],
      "totalBookings": 1,
      "totalSpent": 0,
      "firstVisit": "07/29/2025 11:38:52 pm",
      "lastVisit": "07/29/2025 11:38:52 pm",
      "status": "active",
      "createdAt": "2025-07-29T23:38:52.000Z"
    },
    {
      "id": "cust_1764767405531_kvjg7a",
      "name": "Matty Ott",
      "phone": "5049133688",
      "email": "",
      "zipCode": "70785",
      "vehicles": [
        "2015 f150 4 door xlt"
      ],
      "totalBookings": 1,
      "totalSpent": 0,
      "firstVisit": "07/29/2025 4:13:04 pm",
      "lastVisit": "07/29/2025 4:13:04 pm",
      "status": "active",
      "createdAt": "2025-07-29T16:13:04.000Z"
    },
    {
      "id": "cust_1764767405531_y3t91l",
      "name": "Emily Harr",
      "phone": "2255737027",
      "email": "",
      "zipCode": "70791",
      "vehicles": [
        "2018 Subaru Forrester"
      ],
      "totalBookings": 1,
      "totalSpent": 0,
      "firstVisit": "07/29/2025 12:12:28 pm",
      "lastVisit": "07/29/2025 12:12:28 pm",
      "status": "active",
      "createdAt": "2025-07-29T12:12:28.000Z"
    },
    {
      "id": "cust_1764767405531_lkvvdu",
      "name": "Angie Bringaze",
      "phone": "2252416446",
      "email": "",
      "zipCode": "70808",
      "vehicles": [
        "Lexus LS"
      ],
      "totalBookings": 2,
      "totalSpent": 0,
      "firstVisit": "07/28/2025 6:33:58 pm",
      "lastVisit": "07/28/2025 6:32:58 pm",
      "status": "active",
      "createdAt": "2025-07-28T18:33:58.000Z"
    },
    {
      "id": "cust_1764767405531_se4s4e",
      "name": "Paul Opperman",
      "phone": "2252454992",
      "email": "",
      "zipCode": "70809",
      "vehicles": [
        "Hyundai Kona"
      ],
      "totalBookings": 1,
      "totalSpent": 0,
      "firstVisit": "07/27/2025 5:37:49 am",
      "lastVisit": "07/27/2025 5:37:49 am",
      "status": "active",
      "createdAt": "2025-07-27T05:37:49.000Z"
    },
    {
      "id": "cust_1764767405531_cc9b19",
      "name": "Okezzi Festus Ukorigho",
      "phone": "2254417144",
      "email": "",
      "zipCode": "70820",
      "vehicles": [
        "Hyunda ELantra 2018"
      ],
      "totalBookings": 1,
      "totalSpent": 0,
      "firstVisit": "07/26/2025 10:20:49 pm",
      "lastVisit": "07/26/2025 10:20:49 pm",
      "status": "active",
      "createdAt": "2025-07-26T22:20:49.000Z"
    },
    {
      "id": "cust_1764767405531_hvi3qt",
      "name": "David J",
      "phone": "2256770042",
      "email": "",
      "zipCode": "70817",
      "vehicles": [
        "Jeep Grand Cherokee"
      ],
      "totalBookings": 1,
      "totalSpent": 0,
      "firstVisit": "07/26/2025 3:21:48 pm",
      "lastVisit": "07/26/2025 3:21:48 pm",
      "status": "active",
      "createdAt": "2025-07-26T15:21:48.000Z"
    },
    {
      "id": "cust_1764767405531_76hn51",
      "name": "Jacob Young",
      "phone": "2254410265",
      "email": "",
      "zipCode": "70808",
      "vehicles": [
        "Ford f250"
      ],
      "totalBookings": 1,
      "totalSpent": 0,
      "firstVisit": "07/24/2025 1:35:25 am",
      "lastVisit": "07/24/2025 1:35:25 am",
      "status": "active",
      "createdAt": "2025-07-24T01:35:25.000Z"
    },
    {
      "id": "cust_1764767405531_ka4oni",
      "name": "JOE RAZO",
      "phone": "7135486245",
      "email": "",
      "zipCode": "70836",
      "vehicles": [
        "Ram 1500"
      ],
      "totalBookings": 1,
      "totalSpent": 0,
      "firstVisit": "07/23/2025 9:21:56 pm",
      "lastVisit": "07/23/2025 9:21:56 pm",
      "status": "active",
      "createdAt": "2025-07-23T21:21:56.000Z"
    },
    {
      "id": "cust_1764767405531_vnktb9",
      "name": "Daniel Andrews",
      "phone": "2023291698",
      "email": "",
      "zipCode": "70806",
      "vehicles": [
        "Subaru Outback 2021"
      ],
      "totalBookings": 1,
      "totalSpent": 0,
      "firstVisit": "07/23/2025 1:49:23 am",
      "lastVisit": "07/23/2025 1:49:23 am",
      "status": "active",
      "createdAt": "2025-07-23T01:49:23.000Z"
    },
    {
      "id": "cust_1764767405531_85ub6t",
      "name": "Alex Walker",
      "phone": "9852125728",
      "email": "",
      "zipCode": "70052",
      "vehicles": [
        "2022 ford f150"
      ],
      "totalBookings": 1,
      "totalSpent": 0,
      "firstVisit": "07/21/2025 11:15:03 pm",
      "lastVisit": "07/21/2025 11:15:03 pm",
      "status": "active",
      "createdAt": "2025-07-21T23:15:03.000Z"
    },
    {
      "id": "cust_1764767405531_1pkrtg",
      "name": "Lisa",
      "phone": "2253153888",
      "email": "",
      "zipCode": "70809",
      "vehicles": [
        "2017 Lexus 350"
      ],
      "totalBookings": 1,
      "totalSpent": 0,
      "firstVisit": "07/21/2025 8:59:18 pm",
      "lastVisit": "07/21/2025 8:59:18 pm",
      "status": "active",
      "createdAt": "2025-07-21T20:59:18.000Z"
    },
    {
      "id": "cust_1764767405531_5bwxhu",
      "name": "Cassandra Siegel",
      "phone": "7196516611",
      "email": "",
      "zipCode": "70817",
      "vehicles": [
        "Hyundai Santa Fe"
      ],
      "totalBookings": 1,
      "totalSpent": 0,
      "firstVisit": "07/21/2025 3:13:36 pm",
      "lastVisit": "07/21/2025 3:13:36 pm",
      "status": "active",
      "createdAt": "2025-07-21T15:13:36.000Z"
    },
    {
      "id": "cust_1764767405531_u15mby",
      "name": "Brian Prescott",
      "phone": "2103320958",
      "email": "",
      "zipCode": "70808",
      "vehicles": [
        "BMW X3"
      ],
      "totalBookings": 1,
      "totalSpent": 0,
      "firstVisit": "07/18/2025 6:24:17 pm",
      "lastVisit": "07/18/2025 6:24:17 pm",
      "status": "active",
      "createdAt": "2025-07-18T18:24:17.000Z"
    },
    {
      "id": "cust_1764767405531_jcldk9",
      "name": "Test",
      "phone": "2253355533",
      "email": "",
      "zipCode": "Test",
      "vehicles": [
        "Test"
      ],
      "totalBookings": 1,
      "totalSpent": 0,
      "firstVisit": "07/17/2025 11:45:23 am",
      "lastVisit": "07/17/2025 11:45:23 am",
      "status": "active",
      "createdAt": "2025-07-17T11:45:23.000Z"
    },
    {
      "id": "cust_1764767405531_95yoa7",
      "name": "Robin Pilcher",
      "phone": "2258060458",
      "email": "",
      "zipCode": "70809",
      "vehicles": [
        "BMW 740"
      ],
      "totalBookings": 1,
      "totalSpent": 0,
      "firstVisit": "07/07/2025 2:45:54 am",
      "lastVisit": "07/07/2025 2:45:54 am",
      "status": "active",
      "createdAt": "2025-07-07T02:45:54.000Z"
    },
    {
      "id": "cust_1764767405531_98x8ao",
      "name": "Davonte Numa",
      "phone": "5045591732",
      "email": "",
      "zipCode": "70057",
      "vehicles": [
        "BMW 530"
      ],
      "totalBookings": 1,
      "totalSpent": 0,
      "firstVisit": "07/05/2025 10:23:54 pm",
      "lastVisit": "07/05/2025 10:23:54 pm",
      "status": "active",
      "createdAt": "2025-07-05T22:23:54.000Z"
    },
    {
      "id": "cust_1764767405531_vw4kmu",
      "name": "Jarrett Rabai",
      "phone": "2252290778",
      "email": "",
      "zipCode": "70817",
      "vehicles": [
        "Toyota Tundra TRDPro 2022"
      ],
      "totalBookings": 1,
      "totalSpent": 0,
      "firstVisit": "07/05/2025 5:55:27 pm",
      "lastVisit": "07/05/2025 5:55:27 pm",
      "status": "active",
      "createdAt": "2025-07-05T17:55:27.000Z"
    },
    {
      "id": "cust_1764767405531_wtbt1p",
      "name": "Elizabeth Coakham",
      "phone": "9858074672",
      "email": "",
      "zipCode": "70809",
      "vehicles": [
        "Subaru Outback"
      ],
      "totalBookings": 1,
      "totalSpent": 0,
      "firstVisit": "07/02/2025 7:58:22 pm",
      "lastVisit": "07/02/2025 7:58:22 pm",
      "status": "active",
      "createdAt": "2025-07-02T19:58:22.000Z"
    },
    {
      "id": "cust_1764767405531_ubd6sz",
      "name": "Benjamin Coenen",
      "phone": "4029607813",
      "email": "",
      "zipCode": "70806",
      "vehicles": [
        "GX 550 Lexus"
      ],
      "totalBookings": 1,
      "totalSpent": 0,
      "firstVisit": "07/02/2025 4:02:52 pm",
      "lastVisit": "07/02/2025 4:02:52 pm",
      "status": "active",
      "createdAt": "2025-07-02T16:02:52.000Z"
    },
    {
      "id": "cust_1764767405531_ltnzgc",
      "name": "Deborah",
      "phone": "2252515646",
      "email": "",
      "zipCode": "70812",
      "vehicles": [
        "Nissan rouge"
      ],
      "totalBookings": 1,
      "totalSpent": 0,
      "firstVisit": "07/01/2025 8:21:14 pm",
      "lastVisit": "07/01/2025 8:21:14 pm",
      "status": "active",
      "createdAt": "2025-07-01T20:21:14.000Z"
    },
    {
      "id": "cust_1764767405531_efmry8",
      "name": "Noah Hanshaw",
      "phone": "9367774467",
      "email": "",
      "zipCode": "70808",
      "vehicles": [
        "Infiniti G37"
      ],
      "totalBookings": 1,
      "totalSpent": 0,
      "firstVisit": "06/30/2025 11:15:35 pm",
      "lastVisit": "06/30/2025 11:15:35 pm",
      "status": "active",
      "createdAt": "2025-06-30T23:15:35.000Z"
    },
    {
      "id": "cust_1764767405531_o4sh0q",
      "name": "Michael Daigle",
      "phone": "9858596828",
      "email": "",
      "zipCode": "70806",
      "vehicles": [
        "2014 Chevrolet Impala"
      ],
      "totalBookings": 1,
      "totalSpent": 0,
      "firstVisit": "06/30/2025 7:00:16 pm",
      "lastVisit": "06/30/2025 7:00:16 pm",
      "status": "active",
      "createdAt": "2025-06-30T19:00:16.000Z"
    },
    {
      "id": "cust_1764767405531_7ugvdr",
      "name": "Keymah Hills",
      "phone": "2254285378",
      "email": "",
      "zipCode": "70807",
      "vehicles": [
        "2022 Toyota Corella"
      ],
      "totalBookings": 1,
      "totalSpent": 0,
      "firstVisit": "06/30/2025 4:14:13 am",
      "lastVisit": "06/30/2025 4:14:13 am",
      "status": "active",
      "createdAt": "2025-06-30T04:14:13.000Z"
    },
    {
      "id": "cust_1764767405531_tc3jyn",
      "name": "Taylor larkin",
      "phone": "5047155586",
      "email": "",
      "zipCode": "70774",
      "vehicles": [
        "F250"
      ],
      "totalBookings": 1,
      "totalSpent": 0,
      "firstVisit": "06/29/2025 6:56:06 pm",
      "lastVisit": "06/29/2025 6:56:06 pm",
      "status": "active",
      "createdAt": "2025-06-29T18:56:06.000Z"
    },
    {
      "id": "cust_1764767405531_knllhj",
      "name": "Megan Rester",
      "phone": "6622300701",
      "email": "",
      "zipCode": "70816",
      "vehicles": [
        "Lexus NX250"
      ],
      "totalBookings": 1,
      "totalSpent": 0,
      "firstVisit": "06/28/2025 4:03:35 pm",
      "lastVisit": "06/28/2025 4:03:35 pm",
      "status": "active",
      "createdAt": "2025-06-28T16:03:35.000Z"
    },
    {
      "id": "cust_1764767405531_714aaj",
      "name": "Kaitlyn Childress",
      "phone": "2259752072",
      "email": "",
      "zipCode": "70774",
      "vehicles": [
        "2024 Honda Accord EX"
      ],
      "totalBookings": 1,
      "totalSpent": 0,
      "firstVisit": "06/28/2025 1:26:20 pm",
      "lastVisit": "06/28/2025 1:26:20 pm",
      "status": "active",
      "createdAt": "2025-06-28T13:26:20.000Z"
    },
    {
      "id": "cust_1764767405532_lsjai4",
      "name": "Richard Conerly",
      "phone": "2257882383",
      "email": "",
      "zipCode": "70739",
      "vehicles": [
        "2007 Toyota FJ Cruiser"
      ],
      "totalBookings": 1,
      "totalSpent": 0,
      "firstVisit": "06/26/2025 11:32:49 pm",
      "lastVisit": "06/26/2025 11:32:49 pm",
      "status": "active",
      "createdAt": "2025-06-26T23:32:49.000Z"
    },
    {
      "id": "cust_1764767405532_wi5jar",
      "name": "Lillian Berry",
      "phone": "3184479960",
      "email": "",
      "zipCode": "70820",
      "vehicles": [
        "Chevrolet Equinox"
      ],
      "totalBookings": 1,
      "totalSpent": 0,
      "firstVisit": "06/26/2025 10:01:38 pm",
      "lastVisit": "06/26/2025 10:01:38 pm",
      "status": "active",
      "createdAt": "2025-06-26T22:01:38.000Z"
    },
    {
      "id": "cust_1764767405532_iklgfv",
      "name": "Terrell Williams",
      "phone": "2253298747",
      "email": "",
      "zipCode": "70814",
      "vehicles": [
        "Chevy tahoe"
      ],
      "totalBookings": 1,
      "totalSpent": 0,
      "firstVisit": "06/25/2025 5:57:18 pm",
      "lastVisit": "06/25/2025 5:57:18 pm",
      "status": "active",
      "createdAt": "2025-06-25T17:57:18.000Z"
    },
    {
      "id": "cust_1764767405532_oj86mj",
      "name": "Andrew Truxillo",
      "phone": "2252813874",
      "email": "",
      "zipCode": "70810",
      "vehicles": [
        "2019 Honda HRV"
      ],
      "totalBookings": 1,
      "totalSpent": 0,
      "firstVisit": "06/25/2025 1:37:52 pm",
      "lastVisit": "06/25/2025 1:37:52 pm",
      "status": "active",
      "createdAt": "2025-06-25T13:37:52.000Z"
    },
    {
      "id": "cust_1764767405532_nmycs1",
      "name": "Mike marler",
      "phone": "9366768490",
      "email": "",
      "zipCode": "70809",
      "vehicles": [
        "2025 Toyota tundra"
      ],
      "totalBookings": 1,
      "totalSpent": 0,
      "firstVisit": "06/25/2025 2:38:19 am",
      "lastVisit": "06/25/2025 2:38:19 am",
      "status": "active",
      "createdAt": "2025-06-25T02:38:19.000Z"
    },
    {
      "id": "cust_1764767405532_hajtn6",
      "name": "Scott Wilkes",
      "phone": "3183057513",
      "email": "",
      "zipCode": "70809",
      "vehicles": [
        "Toyota corolla"
      ],
      "totalBookings": 1,
      "totalSpent": 0,
      "firstVisit": "06/24/2025 1:24:32 am",
      "lastVisit": "06/24/2025 1:24:32 am",
      "status": "active",
      "createdAt": "2025-06-24T01:24:32.000Z"
    },
    {
      "id": "cust_1764767405532_tej6me",
      "name": "Samantha Huesmann",
      "phone": "2255888207",
      "email": "",
      "zipCode": "70764",
      "vehicles": [
        "Passat Volkswagen"
      ],
      "totalBookings": 1,
      "totalSpent": 0,
      "firstVisit": "06/22/2025 6:25:24 pm",
      "lastVisit": "06/22/2025 6:25:24 pm",
      "status": "active",
      "createdAt": "2025-06-22T18:25:24.000Z"
    },
    {
      "id": "cust_1764767405532_2o4gn2",
      "name": "Kendrick Bell",
      "phone": "2252762549",
      "email": "",
      "zipCode": "70714",
      "vehicles": [
        "Chevy silverado 1500"
      ],
      "totalBookings": 1,
      "totalSpent": 0,
      "firstVisit": "06/22/2025 1:10:37 pm",
      "lastVisit": "06/22/2025 1:10:37 pm",
      "status": "active",
      "createdAt": "2025-06-22T13:10:37.000Z"
    },
    {
      "id": "cust_1764767405532_e2h27q",
      "name": "Adam",
      "phone": "3466568635",
      "email": "",
      "zipCode": "70769",
      "vehicles": [
        "Toyota Tundra"
      ],
      "totalBookings": 1,
      "totalSpent": 0,
      "firstVisit": "06/22/2025 1:03:49 pm",
      "lastVisit": "06/22/2025 1:03:49 pm",
      "status": "active",
      "createdAt": "2025-06-22T13:03:49.000Z"
    },
    {
      "id": "cust_1764767405532_otvs8y",
      "name": "Patrick Clarkston",
      "phone": "3377039347",
      "email": "",
      "zipCode": "70809",
      "vehicles": [
        "2013 Ford Fusion"
      ],
      "totalBookings": 1,
      "totalSpent": 0,
      "firstVisit": "06/21/2025 11:51:20 pm",
      "lastVisit": "06/21/2025 11:51:20 pm",
      "status": "active",
      "createdAt": "2025-06-21T23:51:20.000Z"
    },
    {
      "id": "cust_1764767405532_64lbk2",
      "name": "Deniya j",
      "phone": "2255722284",
      "email": "",
      "zipCode": "70818",
      "vehicles": [
        "Honda accord sport"
      ],
      "totalBookings": 1,
      "totalSpent": 0,
      "firstVisit": "06/21/2025 12:01:55 pm",
      "lastVisit": "06/21/2025 12:01:55 pm",
      "status": "active",
      "createdAt": "2025-06-21T12:01:55.000Z"
    },
    {
      "id": "cust_1764767405532_xvtp5y",
      "name": "Tabrea",
      "phone": "6145886575",
      "email": "",
      "zipCode": "70809",
      "vehicles": [
        "2011 Honda Accord"
      ],
      "totalBookings": 1,
      "totalSpent": 0,
      "firstVisit": "06/20/2025 8:01:35 pm",
      "lastVisit": "06/20/2025 8:01:35 pm",
      "status": "active",
      "createdAt": "2025-06-20T20:01:35.000Z"
    },
    {
      "id": "cust_1764767405532_w3wqp7",
      "name": "Jay Isch",
      "phone": "7815000054",
      "email": "",
      "zipCode": "70808",
      "vehicles": [
        "2012 Cadillac CTS-V Coupe"
      ],
      "totalBookings": 1,
      "totalSpent": 0,
      "firstVisit": "06/20/2025 6:37:33 pm",
      "lastVisit": "06/20/2025 6:37:33 pm",
      "status": "active",
      "createdAt": "2025-06-20T18:37:33.000Z"
    },
    {
      "id": "cust_1764767405532_6fziz0",
      "name": "Jason Laneaux",
      "phone": "2258106880",
      "email": "",
      "zipCode": "70809",
      "vehicles": [
        "2022 Ford Bronco"
      ],
      "totalBookings": 1,
      "totalSpent": 0,
      "firstVisit": "06/20/2025 11:42:40 am",
      "lastVisit": "06/20/2025 11:42:40 am",
      "status": "active",
      "createdAt": "2025-06-20T11:42:40.000Z"
    },
    {
      "id": "cust_1764767405532_rqd1kl",
      "name": "Tayler",
      "phone": "2253675955",
      "email": "",
      "zipCode": "70814",
      "vehicles": [
        "2007 Honda Accord"
      ],
      "totalBookings": 1,
      "totalSpent": 0,
      "firstVisit": "06/19/2025 6:03:55 pm",
      "lastVisit": "06/19/2025 6:03:55 pm",
      "status": "active",
      "createdAt": "2025-06-19T18:03:55.000Z"
    },
    {
      "id": "cust_1764767405532_0uc90n",
      "name": "Rivers Butler",
      "phone": "2256204228",
      "email": "",
      "zipCode": "70816",
      "vehicles": [
        "2023 Dodge Challenger"
      ],
      "totalBookings": 1,
      "totalSpent": 0,
      "firstVisit": "06/19/2025 12:24:07 pm",
      "lastVisit": "06/19/2025 12:24:07 pm",
      "status": "active",
      "createdAt": "2025-06-19T12:24:07.000Z"
    },
    {
      "id": "cust_1764767405532_q4gp5u",
      "name": "Danny Ahlskog",
      "phone": "2257188096",
      "email": "",
      "zipCode": "70817",
      "vehicles": [
        "Ford F150"
      ],
      "totalBookings": 1,
      "totalSpent": 0,
      "firstVisit": "06/19/2025 12:13:45 pm",
      "lastVisit": "06/19/2025 12:13:45 pm",
      "status": "active",
      "createdAt": "2025-06-19T12:13:45.000Z"
    },
    {
      "id": "cust_1764767405533_bpmqrz",
      "name": "Kourtney Milson",
      "phone": "3375040434",
      "email": "",
      "zipCode": "70785",
      "vehicles": [
        "Hyundai Elantra 2023"
      ],
      "totalBookings": 1,
      "totalSpent": 0,
      "firstVisit": "06/18/2025 12:29:00 am",
      "lastVisit": "06/18/2025 12:29:00 am",
      "status": "active",
      "createdAt": "2025-06-18T00:29:00.000Z"
    },
    {
      "id": "cust_1764767405533_wu83md",
      "name": "Troy Nick Randolph",
      "phone": "2254063108",
      "email": "",
      "zipCode": "70802",
      "vehicles": [
        "2016 Toyota Corolla le"
      ],
      "totalBookings": 1,
      "totalSpent": 0,
      "firstVisit": "06/17/2025 1:04:19 pm",
      "lastVisit": "06/17/2025 1:04:19 pm",
      "status": "active",
      "createdAt": "2025-06-17T13:04:19.000Z"
    },
    {
      "id": "cust_1764767405533_etvv8y",
      "name": "Donovan Gayden",
      "phone": "5042379842",
      "email": "",
      "zipCode": "70810",
      "vehicles": [
        "Nissan Rogue Sport"
      ],
      "totalBookings": 1,
      "totalSpent": 0,
      "firstVisit": "06/16/2025 2:08:32 am",
      "lastVisit": "06/16/2025 2:08:32 am",
      "status": "active",
      "createdAt": "2025-06-16T02:08:32.000Z"
    },
    {
      "id": "cust_1764767405533_3m6v88",
      "name": "Jackson",
      "phone": "2258887187",
      "email": "",
      "zipCode": "70816",
      "vehicles": [
        "nissan altima"
      ],
      "totalBookings": 1,
      "totalSpent": 0,
      "firstVisit": "06/15/2025 10:40:48 pm",
      "lastVisit": "06/15/2025 10:40:48 pm",
      "status": "active",
      "createdAt": "2025-06-15T22:40:48.000Z"
    },
    {
      "id": "cust_1764767405533_mnjq2v",
      "name": "Naquincy pierson",
      "phone": "2258028607",
      "email": "",
      "zipCode": "70815",
      "vehicles": [
        "2018 dodge ram 1500 sport"
      ],
      "totalBookings": 1,
      "totalSpent": 0,
      "firstVisit": "06/15/2025 9:22:11 am",
      "lastVisit": "06/15/2025 9:22:11 am",
      "status": "active",
      "createdAt": "2025-06-15T09:22:11.000Z"
    },
    {
      "id": "cust_1764767405533_wq2bpl",
      "name": "Mark Faber",
      "phone": "2259370857",
      "email": "",
      "zipCode": "70726",
      "vehicles": [
        "2021 gmc sierra 1500"
      ],
      "totalBookings": 1,
      "totalSpent": 0,
      "firstVisit": "06/14/2025 1:38:21 am",
      "lastVisit": "06/14/2025 1:38:21 am",
      "status": "active",
      "createdAt": "2025-06-14T01:38:21.000Z"
    },
    {
      "id": "cust_1764767405533_kbnf1o",
      "name": "Garrett barnes",
      "phone": "9852648117",
      "email": "",
      "zipCode": "70817",
      "vehicles": [
        "Tesla model 3"
      ],
      "totalBookings": 1,
      "totalSpent": 0,
      "firstVisit": "06/13/2025 11:57:31 pm",
      "lastVisit": "06/13/2025 11:57:31 pm",
      "status": "active",
      "createdAt": "2025-06-13T23:57:31.000Z"
    },
    {
      "id": "cust_1764767405533_w0wbsh",
      "name": "Jackson Martin",
      "phone": "2253295121",
      "email": "",
      "zipCode": "70809",
      "vehicles": [
        "TOYOTA Tacoma"
      ],
      "totalBookings": 1,
      "totalSpent": 0,
      "firstVisit": "06/13/2025 9:37:33 pm",
      "lastVisit": "06/13/2025 9:37:33 pm",
      "status": "active",
      "createdAt": "2025-06-13T21:37:33.000Z"
    },
    {
      "id": "cust_1764767405533_peepzx",
      "name": "Eleanor creel",
      "phone": "2252669164",
      "email": "",
      "zipCode": "70706",
      "vehicles": [
        "2016 dodge charger"
      ],
      "totalBookings": 1,
      "totalSpent": 0,
      "firstVisit": "06/12/2025 10:59:15 pm",
      "lastVisit": "06/12/2025 10:59:15 pm",
      "status": "active",
      "createdAt": "2025-06-12T22:59:15.000Z"
    },
    {
      "id": "cust_1764767405533_gvmj8m",
      "name": "Cody Etheridge",
      "phone": "2252764126",
      "email": "",
      "zipCode": "70817",
      "vehicles": [
        "2017 Nissan Titan"
      ],
      "totalBookings": 1,
      "totalSpent": 0,
      "firstVisit": "06/12/2025 1:24:38 pm",
      "lastVisit": "06/12/2025 1:24:38 pm",
      "status": "active",
      "createdAt": "2025-06-12T13:24:38.000Z"
    },
    {
      "id": "cust_1764767405533_5bsfy7",
      "name": "Blake Langford",
      "phone": "3182834800",
      "email": "",
      "zipCode": "70815",
      "vehicles": [
        "Mazda 6"
      ],
      "totalBookings": 1,
      "totalSpent": 0,
      "firstVisit": "06/12/2025 1:10:16 pm",
      "lastVisit": "06/12/2025 1:10:16 pm",
      "status": "active",
      "createdAt": "2025-06-12T13:10:16.000Z"
    },
    {
      "id": "cust_1764767405533_zcf6nd",
      "name": "Spencer Habibi",
      "phone": "9852224925",
      "email": "",
      "zipCode": "70820",
      "vehicles": [
        "Hyundai sonata n line 2023"
      ],
      "totalBookings": 1,
      "totalSpent": 0,
      "firstVisit": "06/10/2025 11:24:26 pm",
      "lastVisit": "06/10/2025 11:24:26 pm",
      "status": "active",
      "createdAt": "2025-06-10T23:24:26.000Z"
    },
    {
      "id": "cust_1764767405533_629u2a",
      "name": "Adrienne Tassin",
      "phone": "2252476421",
      "email": "",
      "zipCode": "70809",
      "vehicles": [
        "Honda accord"
      ],
      "totalBookings": 1,
      "totalSpent": 0,
      "firstVisit": "06/10/2025 2:31:48 pm",
      "lastVisit": "06/10/2025 2:31:48 pm",
      "status": "active",
      "createdAt": "2025-06-10T14:31:48.000Z"
    },
    {
      "id": "cust_1764767405533_ock02c",
      "name": "Chase Weatherly",
      "phone": "2255735093",
      "email": "",
      "zipCode": "70714",
      "vehicles": [
        "GMC sierra 1500"
      ],
      "totalBookings": 1,
      "totalSpent": 0,
      "firstVisit": "06/10/2025 12:10:52 am",
      "lastVisit": "06/10/2025 12:10:52 am",
      "status": "active",
      "createdAt": "2025-06-10T00:10:52.000Z"
    },
    {
      "id": "cust_1764767405533_3htbsk",
      "name": "Emily Calkins",
      "phone": "2256150012",
      "email": "",
      "zipCode": "70817",
      "vehicles": [
        "Toyota Tacoma"
      ],
      "totalBookings": 1,
      "totalSpent": 0,
      "firstVisit": "06/09/2025 8:19:23 pm",
      "lastVisit": "06/09/2025 8:19:23 pm",
      "status": "active",
      "createdAt": "2025-06-09T20:19:23.000Z"
    },
    {
      "id": "cust_1764767405533_v2sml1",
      "name": "Nicholas Bennett",
      "phone": "8324956680",
      "email": "",
      "zipCode": "70814",
      "vehicles": [
        "2013 Lexus es350",
        "Lexus es 350"
      ],
      "totalBookings": 2,
      "totalSpent": 0,
      "firstVisit": "06/09/2025 9:33:08 am",
      "lastVisit": "06/09/2025 9:09:42 am",
      "status": "active",
      "createdAt": "2025-06-09T09:33:08.000Z"
    },
    {
      "id": "cust_1764767405533_31jiwb",
      "name": "Josh Dixon",
      "phone": "2259642869",
      "email": "",
      "zipCode": "70817",
      "vehicles": [
        "2019 Ram 1500"
      ],
      "totalBookings": 1,
      "totalSpent": 0,
      "firstVisit": "06/08/2025 12:11:39 am",
      "lastVisit": "06/08/2025 12:11:39 am",
      "status": "active",
      "createdAt": "2025-06-08T00:11:39.000Z"
    },
    {
      "id": "cust_1764767405533_0b25rw",
      "name": "Pearl B",
      "phone": "2253462572",
      "email": "",
      "zipCode": "70791",
      "vehicles": [
        "2022 Silverado 1500",
        "2022 Bkack Chevy Silverado"
      ],
      "totalBookings": 2,
      "totalSpent": 0,
      "firstVisit": "06/06/2025 12:17:50 pm",
      "lastVisit": "06/06/2025 7:38:39 am",
      "status": "active",
      "createdAt": "2025-06-06T12:17:50.000Z"
    },
    {
      "id": "cust_1764767405533_6nm7x4",
      "name": "Jimmy Brown",
      "phone": "7692443549",
      "email": "",
      "zipCode": "39638",
      "vehicles": [
        "2022 Chevrolet Silverado 1500"
      ],
      "totalBookings": 1,
      "totalSpent": 0,
      "firstVisit": "06/06/2025 7:35:24 am",
      "lastVisit": "06/06/2025 7:35:24 am",
      "status": "active",
      "createdAt": "2025-06-06T07:35:24.000Z"
    },
    {
      "id": "cust_1764767405533_3hncec",
      "name": "Cindy Bishop",
      "phone": "2259335435",
      "email": "",
      "zipCode": "70820",
      "vehicles": [
        "Infiniti q50",
        "2014 Infiniti Q50"
      ],
      "totalBookings": 2,
      "totalSpent": 0,
      "firstVisit": "06/06/2025 2:11:57 am",
      "lastVisit": "05/26/2025 11:25:50 pm",
      "status": "active",
      "createdAt": "2025-06-06T02:11:57.000Z"
    },
    {
      "id": "cust_1764767405533_jtddfy",
      "name": "Ashley Clark",
      "phone": "2252473353",
      "email": "",
      "zipCode": "70817",
      "vehicles": [
        "2025 Range Rover"
      ],
      "totalBookings": 1,
      "totalSpent": 0,
      "firstVisit": "06/04/2025 3:49:49 pm",
      "lastVisit": "06/04/2025 3:49:49 pm",
      "status": "active",
      "createdAt": "2025-06-04T15:49:49.000Z"
    },
    {
      "id": "cust_1764767405533_wunxrq",
      "name": "Seth milioto",
      "phone": "2252906048",
      "email": "",
      "zipCode": "70769",
      "vehicles": [
        "Toyota Tacoma 2016"
      ],
      "totalBookings": 1,
      "totalSpent": 0,
      "firstVisit": "06/03/2025 10:41:32 pm",
      "lastVisit": "06/03/2025 10:41:32 pm",
      "status": "active",
      "createdAt": "2025-06-03T22:41:32.000Z"
    },
    {
      "id": "cust_1764767405533_5uldor",
      "name": "Hema patel",
      "phone": "2259072791",
      "email": "",
      "zipCode": "70726",
      "vehicles": [
        "Tesla model y"
      ],
      "totalBookings": 1,
      "totalSpent": 0,
      "firstVisit": "06/03/2025 5:59:46 pm",
      "lastVisit": "06/03/2025 5:59:46 pm",
      "status": "active",
      "createdAt": "2025-06-03T17:59:46.000Z"
    },
    {
      "id": "cust_1764767405533_14q9rp",
      "name": "Justin Avila",
      "phone": "2254368334",
      "email": "",
      "zipCode": "70714",
      "vehicles": [
        "2020 mustang"
      ],
      "totalBookings": 1,
      "totalSpent": 0,
      "firstVisit": "06/03/2025 8:41:40 am",
      "lastVisit": "06/03/2025 8:41:40 am",
      "status": "active",
      "createdAt": "2025-06-03T08:41:40.000Z"
    },
    {
      "id": "cust_1764767405533_d9rbhc",
      "name": "Kennedy",
      "phone": "5044181850",
      "email": "",
      "zipCode": "70737",
      "vehicles": [
        "18 Chevy camero"
      ],
      "totalBookings": 1,
      "totalSpent": 0,
      "firstVisit": "06/02/2025 9:04:10 pm",
      "lastVisit": "06/02/2025 9:04:10 pm",
      "status": "active",
      "createdAt": "2025-06-02T21:04:10.000Z"
    },
    {
      "id": "cust_1764767405533_il95e3",
      "name": "Teagra Johnson",
      "phone": "5044390176",
      "email": "",
      "zipCode": "70802",
      "vehicles": [
        "Ford escape"
      ],
      "totalBookings": 1,
      "totalSpent": 0,
      "firstVisit": "06/01/2025 3:40:00 am",
      "lastVisit": "06/01/2025 3:40:00 am",
      "status": "active",
      "createdAt": "2025-06-01T03:40:00.000Z"
    },
    {
      "id": "cust_1764767405533_v9hl1j",
      "name": "Owen Kimble",
      "phone": "2259642439",
      "email": "",
      "zipCode": "70706",
      "vehicles": [
        "2013 ford f150"
      ],
      "totalBookings": 1,
      "totalSpent": 0,
      "firstVisit": "05/31/2025 3:51:07 pm",
      "lastVisit": "05/31/2025 3:51:07 pm",
      "status": "active",
      "createdAt": "2025-05-31T15:51:07.000Z"
    },
    {
      "id": "cust_1764767405533_38rmha",
      "name": "Hayes Perrilloux",
      "phone": "9859742701",
      "email": "",
      "zipCode": "70726",
      "vehicles": [
        "2022 GMC Sierra, 2025 Kia Telluride"
      ],
      "totalBookings": 1,
      "totalSpent": 0,
      "firstVisit": "05/30/2025 5:37:30 pm",
      "lastVisit": "05/30/2025 5:37:30 pm",
      "status": "active",
      "createdAt": "2025-05-30T17:37:30.000Z"
    },
    {
      "id": "cust_1764767405533_ebpqxo",
      "name": "Blaine Fassbender",
      "phone": "5042754921",
      "email": "",
      "zipCode": "70808",
      "vehicles": [
        "BMW 5 Series"
      ],
      "totalBookings": 1,
      "totalSpent": 0,
      "firstVisit": "05/29/2025 10:17:49 pm",
      "lastVisit": "05/29/2025 10:17:49 pm",
      "status": "active",
      "createdAt": "2025-05-29T22:17:49.000Z"
    },
    {
      "id": "cust_1764767405533_z6a1ji",
      "name": "Amya Johnson",
      "phone": "2255050021",
      "email": "",
      "zipCode": "70810",
      "vehicles": [
        "Buick Encore GX"
      ],
      "totalBookings": 1,
      "totalSpent": 0,
      "firstVisit": "05/28/2025 10:45:37 pm",
      "lastVisit": "05/28/2025 10:45:37 pm",
      "status": "active",
      "createdAt": "2025-05-28T22:45:37.000Z"
    },
    {
      "id": "cust_1764767405533_v20hrv",
      "name": "Tonya Polozola",
      "phone": "2253154890",
      "email": "",
      "zipCode": "70810",
      "vehicles": [
        "Range Rover sport 2024"
      ],
      "totalBookings": 1,
      "totalSpent": 0,
      "firstVisit": "05/28/2025 6:33:32 pm",
      "lastVisit": "05/28/2025 6:33:32 pm",
      "status": "active",
      "createdAt": "2025-05-28T18:33:32.000Z"
    },
    {
      "id": "cust_1764767405533_bgzb99",
      "name": "Jeremy",
      "phone": "5043120532",
      "email": "",
      "zipCode": "70726",
      "vehicles": [
        "Tesla Model 3"
      ],
      "totalBookings": 1,
      "totalSpent": 0,
      "firstVisit": "05/28/2025 2:34:14 pm",
      "lastVisit": "05/28/2025 2:34:14 pm",
      "status": "active",
      "createdAt": "2025-05-28T14:34:14.000Z"
    },
    {
      "id": "cust_1764767405533_hom8ot",
      "name": "Jake Ibieta",
      "phone": "5049200038",
      "email": "",
      "zipCode": "70124",
      "vehicles": [
        "2022 Dodge Ram Larime"
      ],
      "totalBookings": 1,
      "totalSpent": 0,
      "firstVisit": "05/28/2025 5:45:49 am",
      "lastVisit": "05/28/2025 5:45:49 am",
      "status": "active",
      "createdAt": "2025-05-28T05:45:49.000Z"
    },
    {
      "id": "cust_1764767405533_ueacmo",
      "name": "Jillian Sellars",
      "phone": "9852330082",
      "email": "",
      "zipCode": "70816",
      "vehicles": [
        "GMC Yukon"
      ],
      "totalBookings": 1,
      "totalSpent": 0,
      "firstVisit": "05/27/2025 11:08:50 pm",
      "lastVisit": "05/27/2025 11:08:50 pm",
      "status": "active",
      "createdAt": "2025-05-27T23:08:50.000Z"
    },
    {
      "id": "cust_1764767405533_fp81kp",
      "name": "Knox Hutchinson",
      "phone": "2253613489",
      "email": "",
      "zipCode": "70806",
      "vehicles": [
        "2024 Jeep Wagoneer L"
      ],
      "totalBookings": 1,
      "totalSpent": 0,
      "firstVisit": "05/27/2025 2:31:23 pm",
      "lastVisit": "05/27/2025 2:31:23 pm",
      "status": "active",
      "createdAt": "2025-05-27T14:31:23.000Z"
    },
    {
      "id": "cust_1764767405533_6z2ptf",
      "name": "JaMesya Browhow",
      "phone": "3183591377",
      "email": "",
      "zipCode": "70808",
      "vehicles": [
        "2023 Mazda CX 30",
        "2023 Mazda CX30"
      ],
      "totalBookings": 2,
      "totalSpent": 0,
      "firstVisit": "05/27/2025 12:18:27 am",
      "lastVisit": "05/27/2025 12:12:46 am",
      "status": "active",
      "createdAt": "2025-05-27T00:18:27.000Z"
    },
    {
      "id": "cust_1764767405533_ymkhq1",
      "name": "SANDRA DROUANT",
      "phone": "5044513575",
      "email": "",
      "zipCode": "70815",
      "vehicles": [
        "Toyota Corolla"
      ],
      "totalBookings": 1,
      "totalSpent": 0,
      "firstVisit": "05/25/2025 3:11:59 pm",
      "lastVisit": "05/25/2025 3:11:59 pm",
      "status": "active",
      "createdAt": "2025-05-25T15:11:59.000Z"
    },
    {
      "id": "cust_1764767405533_zrbole",
      "name": "Ja'Mya Mills",
      "phone": "2253128442",
      "email": "",
      "zipCode": "70805",
      "vehicles": [
        "Toyota Corolla"
      ],
      "totalBookings": 1,
      "totalSpent": 0,
      "firstVisit": "05/25/2025 11:20:02 am",
      "lastVisit": "05/25/2025 11:20:02 am",
      "status": "active",
      "createdAt": "2025-05-25T11:20:02.000Z"
    },
    {
      "id": "cust_1764767405533_ryv2gq",
      "name": "Makayla Willson",
      "phone": "2257881134",
      "email": "",
      "zipCode": "70726",
      "vehicles": [
        "2021 Hyundai Elantra"
      ],
      "totalBookings": 1,
      "totalSpent": 0,
      "firstVisit": "05/23/2025 6:57:44 pm",
      "lastVisit": "05/23/2025 6:57:44 pm",
      "status": "active",
      "createdAt": "2025-05-23T18:57:44.000Z"
    },
    {
      "id": "cust_1764767405533_3otg6c",
      "name": "Keith york",
      "phone": "2253173596",
      "email": "",
      "zipCode": "70820",
      "vehicles": [
        "Dodge ram 2020"
      ],
      "totalBookings": 1,
      "totalSpent": 0,
      "firstVisit": "05/21/2025 8:04:56 pm",
      "lastVisit": "05/21/2025 8:04:56 pm",
      "status": "active",
      "createdAt": "2025-05-21T20:04:56.000Z"
    },
    {
      "id": "cust_1764767405533_ilgknk",
      "name": "Sabrina Coleman",
      "phone": "2253482246",
      "email": "",
      "zipCode": "70733",
      "vehicles": [
        "Acura Mdx 2015"
      ],
      "totalBookings": 1,
      "totalSpent": 0,
      "firstVisit": "05/21/2025 6:44:43 pm",
      "lastVisit": "05/21/2025 6:44:43 pm",
      "status": "active",
      "createdAt": "2025-05-21T18:44:43.000Z"
    },
    {
      "id": "cust_1764767405533_hzxtwl",
      "name": "Dakota Bankston",
      "phone": "2255122351",
      "email": "",
      "zipCode": "70785",
      "vehicles": [
        "Dodge Grand Caravan"
      ],
      "totalBookings": 1,
      "totalSpent": 0,
      "firstVisit": "05/21/2025 1:29:39 am",
      "lastVisit": "05/21/2025 1:29:39 am",
      "status": "active",
      "createdAt": "2025-05-21T01:29:39.000Z"
    },
    {
      "id": "cust_1764767405533_tboz1m",
      "name": "Kelly C Pham",
      "phone": "2258026909",
      "email": "",
      "zipCode": "70816",
      "vehicles": [
        "2016 Toyota Rav4"
      ],
      "totalBookings": 1,
      "totalSpent": 0,
      "firstVisit": "05/20/2025 4:35:26 pm",
      "lastVisit": "05/20/2025 4:35:26 pm",
      "status": "active",
      "createdAt": "2025-05-20T16:35:26.000Z"
    },
    {
      "id": "cust_1764767405534_2emj40",
      "name": "Jackson Williamson",
      "phone": "2258464097",
      "email": "",
      "zipCode": "70817",
      "vehicles": [
        "2007 Toyota Corolla CE"
      ],
      "totalBookings": 2,
      "totalSpent": 0,
      "firstVisit": "05/20/2025 4:07:11 am",
      "lastVisit": "05/20/2025 3:42:57 am",
      "status": "active",
      "createdAt": "2025-05-20T04:07:11.000Z"
    },
    {
      "id": "cust_1764767405534_p7u1l7",
      "name": "ZaKierra Stampley",
      "phone": "6018093079",
      "email": "",
      "zipCode": "39069",
      "vehicles": [
        "2021 Toyota Camry se"
      ],
      "totalBookings": 1,
      "totalSpent": 0,
      "firstVisit": "05/19/2025 6:24:55 am",
      "lastVisit": "05/19/2025 6:24:55 am",
      "status": "active",
      "createdAt": "2025-05-19T06:24:55.000Z"
    },
    {
      "id": "cust_1764767405534_qp5gmi",
      "name": "Yusra Chabayta",
      "phone": "2253471669",
      "email": "",
      "zipCode": "70817",
      "vehicles": [
        "2024 volkswagen"
      ],
      "totalBookings": 1,
      "totalSpent": 0,
      "firstVisit": "05/18/2025 6:18:09 pm",
      "lastVisit": "05/18/2025 6:18:09 pm",
      "status": "active",
      "createdAt": "2025-05-18T18:18:09.000Z"
    },
    {
      "id": "cust_1764767405534_hdbc0l",
      "name": "William Meyers",
      "phone": "2252815646",
      "email": "",
      "zipCode": "70808",
      "vehicles": [
        "Jeep Grand Cherokee"
      ],
      "totalBookings": 1,
      "totalSpent": 0,
      "firstVisit": "05/18/2025 3:11:05 pm",
      "lastVisit": "05/18/2025 3:11:05 pm",
      "status": "active",
      "createdAt": "2025-05-18T15:11:05.000Z"
    },
    {
      "id": "cust_1764767405534_aailif",
      "name": "Victoria Anderson",
      "phone": "2552411760",
      "email": "",
      "zipCode": "70816",
      "vehicles": [
        "2005 Chevy Duramax"
      ],
      "totalBookings": 1,
      "totalSpent": 0,
      "firstVisit": "05/18/2025 3:01:07 pm",
      "lastVisit": "05/18/2025 3:01:07 pm",
      "status": "active",
      "createdAt": "2025-05-18T15:01:07.000Z"
    },
    {
      "id": "cust_1764767405534_n2ie0d",
      "name": "Shubh singh",
      "phone": "5595695808",
      "email": "",
      "zipCode": "70754",
      "vehicles": [
        "Mazda cx-5 2015"
      ],
      "totalBookings": 1,
      "totalSpent": 0,
      "firstVisit": "05/17/2025 11:49:25 pm",
      "lastVisit": "05/17/2025 11:49:25 pm",
      "status": "active",
      "createdAt": "2025-05-17T23:49:25.000Z"
    },
    {
      "id": "cust_1764767405534_c6a74l",
      "name": "DaMya  Darden",
      "phone": "9014222520",
      "email": "",
      "zipCode": "70807",
      "vehicles": [
        "Lexus is350"
      ],
      "totalBookings": 1,
      "totalSpent": 0,
      "firstVisit": "05/17/2025 5:19:55 pm",
      "lastVisit": "05/17/2025 5:19:55 pm",
      "status": "active",
      "createdAt": "2025-05-17T17:19:55.000Z"
    },
    {
      "id": "cust_1764767405534_pgzbz2",
      "name": "Jalaysia",
      "phone": "2255069019",
      "email": "",
      "zipCode": "70814",
      "vehicles": [
        "Dodge 2009 ram",
        "Dodge ram 1500 2009"
      ],
      "totalBookings": 2,
      "totalSpent": 0,
      "firstVisit": "05/16/2025 2:19:46 am",
      "lastVisit": "02/20/2025 11:50:52 am",
      "status": "active",
      "createdAt": "2025-05-16T02:19:46.000Z"
    },
    {
